word,phonetic,definition,translation,pos,collins,oxford,tag,bnc,frq,exchange,detail,audio
magic,'mædʒik,n. any art that invokes supernatural powers,"n. 魔术, 魔法\na. 魔术的, 有魔力的, 不可思议的",,3,1,zk gk cet4 cet6 ky toefl ielts,3949,3411,s:magics,,
magma,'mægmә,n. molten rock in the earth's crust,"n. 岩浆, 糊剂, 乳浆剂\n[化] 晶浆",,,,toefl,18015,19802,s:magmas,,
magna,,,"n. 麦格纳（全名为麦格纳国际, 为世界第三大汽车零部件供应商）",,,,,26587,0,,,
magus,'meigәs,n. a magician or sorcerer of ancient times\nn. a member of the Zoroastrian priesthood of the ancient Persians,"n. 魔术家, 占星家",,,,,0,40549,,,
Mahal,'mæhæl,,n. 马哈尔（姓氏）；宫殿,,,,,25991,0,,,
Mahdi,'mɑ:di,n. (Islam) a messianic leader who (according to popular Muslim belief) will appear before the end of the world and restore justice and religion,n. 救世主,,,,,30528,0,s:mahdis,,
Maher,,,n. 马赫（姓氏）,,,,,34824,0,,,
Mahon,mɑ:'hɔ:,,n. 马翁（西班牙地名）；马洪（姓氏）,,,,,27027,0,,,
Maida,,,n. (Maida)人名；(意)马伊达；(英)梅达,,,,,38877,0,,,
mails,,n the bags of letters and packages that are transported by the postal service\nn the system whereby messages are transmitted via the post office\nn a conveyance that transports the letters and packages that are conveyed by the postal system\nn any particular collection of letters or packages that is delivered\nn (Middle Ages) flexible armor made of interlinked metal rings\nv send via the postal service\nv cause to be directed or transmitted to another place,n. 邮件（mail的复数形式）,,,,ielts,0,0,1:s3/0:mail,,
Maine,mein,n. a state in New England,n. 缅因州,,,,,12723,0,,,
mains,,n any very large body of (salt) water\nn a principal pipe in a system that distributes water or gas or electricity or that collects sewage,"n. 电源, 网路, 干线\n[电] 输电干线",,,,,6217,0,,,
Mainz,maints,,"美因兹[德意志联邦共和国西部城市](或译美因茨, 莱茵兰-法耳次州首府)",,,,,27072,0,,,
Maire,,,n. 莫雅（女子名）,,,,,48188,0,,,
maize,meiz,n tall annual cereal grass bearing kernels on large ears: widely cultivated in America in many varieties; the principal cereal in Mexico and Central and South America since pre-Columbian times\nn a strong yellow color,"n. 玉蜀黍, 黄色\na. 玉蜀黍色的, 黄色的",,1,,toefl ielts gre,12455,13829,,,
Majid,,,n. 蜘蛛蟹\nn. (Majid)人名；(阿拉伯、伊朗)马吉德；(西)马希德,,,,,47833,0,,,
major,'meidʒә,n. a commissioned military officer in the United States Army or Air Force or Marines; below lieutenant colonel and above captain\nn. British statesman who was prime minister from 1990 until 1997 (born in 1943)\nn. a university student who is studying a particular field as the principal subject\nn. the principal field of study of a student at a university,"n. 主修课, 成年人, 陆军少校\na. 主要的, 较多的, 大部分的, 成年的, 严重的\nvi. 主修\n[计] 主要, 主要刻度",,5,1,gk cet4 cet6 ky toefl ielts,392,444,s:majors/i:majoring/p:majored/3:majors/d:majored,,
maker,'meikә,n. a person who makes things,"n. 制造者, 上帝\n[经] 制造者, 出票人",,4,,,3102,2343,s:makers,,
Makin,,n battles in World War II in the Pacific (November 1943); United States Marines took the islands from the Japanese after bitter fighting,梅金（人名）,,,,,43806,0,i:makin/0:makin/1:i,,
malai,,,n. (Malai)人名；(罗)马拉伊；(泰)玛莱；(匈)毛洛伊,,,,,32131,0,s:malai/0:malai/1:s,,
Malan,'mælәn,,马伦(姓氏),,,,,44072,0,,,
Malay,mә'lei,n. a member of a people inhabiting the northern Malay Peninsula and Malaysia and parts of the western Malay Archipelago\nn. a western subfamily of Western Malayo-Polynesian languages\na. of or relating to or characteristic of the people or language of Malaysia and the northern Malay Peninsula and parts of the western Malay Archipelago,"n. 马来\na. 马来人的, 马来语的",,,,,26754,25404,s:malays,,
Malet,,n. A little bag or budget.,n. (Malet)人名；(西)马莱特；(英)马利特；(法、意)马莱,,,,,49452,0,,,
Malik,'mɑ:lik,n. the leader of a town or community in some parts of Asia Minor and the Indian subcontinent,n. (巴基斯坦的)酋长,,,,,13511,0,,,
Malmo,,n. a port in southern Sweden,n. 马尔摩（瑞典一座城市）,,,,,40004,0,,,
Malta,'mɒ:ltә,n. a republic on the island of Malta in the Mediterranean; achieved independence from the United Kingdom in 1964\nn. a strategically located island to the south of Sicily in the Mediterranean Sea,n. 马尔他,,,,,8247,0,,,
malty,'mɒ:lti,"a. Consisting, or like, malt.","a. 麦芽的, 有麦芽的, 喝醉的",,,,,0,44135,s:malties,,
maman,,, [地名] [印度尼西亚] 马曼,,,,,18055,0,,,
mamba,'mɑ:mbә,n. arboreal snake of central and southern Africa whose bite is often fatal,n. 树眼镜蛇\n[医] 窄头眼镜蛇(南非产),,,,,0,37667,s:mambas,,
mambo,'mɑ:mbәu,n. a Latin American dance similar in rhythm to the rumba\nv. dance a mambo,"n. 曼博舞, 曼博音乐\nvi. 跳曼博舞",,,,,0,25315,i:mamboing/p:mamboed/3:mambos/d:mamboed,,
Mamet,,n. United States playwright (born in 1947),马梅特,,,,,47224,0,,,
mamma,'mɑ:mә,n informal terms for a mother\nn milk-secreting organ of female mammals,"n. 妈妈, 乳房\n[医] 乳房",,,,,17471,21104,s:mammas,,
mammy,'mæmi,n. an offensive term for a Black nursemaid in the southern U.S.,"n. 妈妈, 保姆",,,,,28380,26273,s:mammies,,
mandy,'mændi,,n. 曼蒂（女子名）；[药]镇静片（等于Mandrax）,,,,,8275,0,,,
Manet,'mɑ:net,n. French painter whose work influenced the impressionists (1832-1883),vi.(他或她)留在台上(用作舞台指示语),,,,,33684,0,,,
manga,'mæŋɡә,,n. 日本漫画,,,,,0,32091,,,
mange,'meindʒ,n. a persistent and contagious disease of the skin causing inflammation and itching and loss of hair; affects domestic animals (and sometimes people),n. 兽疥癣\n[医] 兽疥癣,,,,,45849,39171,,,
mango,'mæŋgәu,"n. large evergreen tropical tree cultivated for its large oval fruit\nn. large oval tropical fruit having smooth skin, juicy aromatic pulp, and a large hairy seed",n. 芒果\n[化] 芒果Mangifera indica,,1,,,19708,9494,s:mangoes,,
mangy,'meindʒi,s. having many worn or threadbare spots in the nap,"a. 疥癣的, 污秽的",,,,gre,35997,26107,,,
mania,'meiniә,n. an irrational but irresistible motive for a belief or action\nn. a mood disorder; an affective disorder in which the victim tends to respond excessively and sometimes violently,"n. 狂躁, 热衷, 狂热\n[医] 躁狂, 狂",,1,,ky toefl ielts gre,14608,12415,s:manias,,
manic,'meinik,s affected with or marked by frenzy or mania uncontrolled by reason,a. 躁狂的\nn. 躁狂者,,1,,,14704,13135,s:manics,,
manly,'mænli,a. possessing qualities befitting a man,"a. 象男人的, 强壮的, 适于男人的",,1,,cet4 cet6,18827,14055,t:manliest/r:manlier,,
manna,'mænә,n. hardened sugary exudation of various trees,"n. 吗哪天赐食物, 精神食粮, 甘露\n[医] 甘露, 木蜜",,,,,26772,25044,,,
Manny,'mæni:,,n. 曼尼（男子名）,,,,,44719,0,,,
manor,'mænә,n. the mansion of a lord or wealthy person\nn. the landed estate of a lord (including the house on it),"n. 庄园\n[法] 采邑, 庄园, 采地",,2,,,4401,14099,s:manors,,
manse,mæns,n. the residence of a clergyman (especially a Presbyterian clergyman),n. 牧师住宅,,,,,26095,29366,s:manses,,
manta,'mæntә,n. a blanket that is used as a cloak or shawl\nn. extremely large pelagic tropical ray that feeds on plankton and small fishes; usually harmless but its size make it dangerous if harpooned,"n. 女用披巾, 外套",,,,,49451,30225,,,
manus,'meinәs,n the (prehensile) extremity of the superior limb,"n. 手, 前肢, 夫权\n[医] 手",,,,,0,44518,,,
Maori,'mauri,n. an ethnic minority of Polynesian and Melanesian descent who speak Maori and live in New Zealand\nn. the Oceanic language spoken by the Maori in New Zealand,"n. 毛利人, 毛利语\na. 毛利人的, 毛利语的",,,,,41375,0,s:maoris/0:maori/1:s,,
maple,'meipl,n. wood of any of various maple trees; especially the hard close-grained wood of the sugar maple; used especially for furniture and flooring\nn. any of numerous trees or shrubs of the genus Acer bearing winged seeds in pairs; north temperate zone,"n. 枫, 枫木, 淡棕色\n[机] 枫木",,1,,gk cet6 gre,10494,5571,s:maples,,
march,mɑ:tʃ,n. the month following February and preceding April\nn. the act of marching; walking with regular steps (especially in a procession of some kind)\nn. a steady advance\nn. a procession of people walking together,"n. 三月, 进行, 行军, 步伐, 长途跋涉, 进行曲, 边界\nvi. 进军, 前进, 交界\nvt. 使行军, 使行进",,3,1,zk gk toefl ielts,695,3483,p:marched/s:marches/i:marching/d:marched/3:marches,,
marco,,,n. 马尔科（人名）；显示地图；展现地图,,,,,7436,0,,,
Marek,,,马雷克（人名）,,,,,29764,0,,,
marge,mɑ:dʒ,n a spread made chiefly from vegetable oils and used as a substitute for butter,n. 边缘（等于margin）,,,,,28446,0,,,
margo,,,[医] 缘,,,,,47357,0,,,
Maria,"mә:'raiә, mә'riә",n. valuable timber tree of Panama,n. 玛丽亚（女名）,,,,,3434,0,,,
marie,"'mɑ:ri(:), mә'ri:",interj. Marry.,n. 玛丽（女子名）,,,,,3896,0,,,
Marin,'mærin,,n. 马林（姓氏）,,,,,34014,0,,,
mario,"'mæriәj, 'mɑ:-",,n. 马里奥（男子名）,,,,,9250,0,,,
maris,'mæris,n a member of a rural Finnish people living in eastern Russia\nn the Finnic language spoken by the Cheremis,abbr. 海事发展情报处（Maritime Research Information Service）,,,,,42574,0,,,
marks,,n. English businessman who created a retail chain (1888-1964),"n. 标记, 记号；唛头, 分数；台面标志",,,,ielts,6038,0,0:mark/1:s3,,
Marne,mɑ:n,,n. 马恩（法国省名）；马恩河（法国东北部河流）,,,,,29918,0,,,
marry,'mæri,v. take in marriage\nv. perform a marriage ceremony,"vt. 与...结婚, 娶, 嫁\nvi. 结婚",,4,1,zk gk cet4 ky,1217,1333,p:married/d:married/i:marrying/3:marries,,
marsh,mɑ:ʃ,n. low-lying wet land with grassy vegetation; usually is a transition zone between land and water\nn. United States painter (1898-1954)\nn. New Zealand writer of detective stories (1899-1982),"n. 沼泽, 湿地\na. 沼泽的",,1,,cet6 toefl ielts gre,6540,6794,s:marshes,,
Marta,,,n. 玛尔塔（姓氏名）,,,,,49283,0,,,
Marti,,n. Cuban poet and revolutionary who fought for Cuban independence from Spain (1853-1895),马蒂（人名）,,,,,27575,0,,,
marty,'mɑ:ti,,"n. 马蒂（男子名, Martin的异体）",,,,,25632,0,,,
Masai,mɑ:'sai,n. a Nilotic language,n. 马萨伊人,,,,,11007,0,,,
maser,'meizә,n. an acronym for microwave amplification by stimulated emission of radiation; an amplifier that works on the same principle as a laser and emits coherent microwave radiation,n. 微波激射器\n[电] 微射,,,,,0,30014,s:masers,,
Masha,,,玛莎（人名）,,,,,31714,0,,,
mason,meisn,n. American Revolutionary leader from Virginia whose objections led to the drafting of the Bill of Rights (1725-1792)\nn. English film actor (1909-1984)\nn. English writer (1865-1948)\nn. a craftsman who works with stone or brick,"n. 泥瓦匠, 共济会会员\nvt. 用砖瓦砌成",,1,,toefl gre,6612,15637,s:masons,,
masse,mæ'sei,n. a shot in billiards made by hitting the cue ball with the cue held nearly vertically; the cue ball spins around another ball before hitting the object ball, [体]竖直挫球,,,,,0,42575,,,
Masud,,,n. (Masud)人名；(伊朗、巴基、阿塞、土库、哈萨、塔吉、乌兹、吉尔、阿拉伯)马苏德,,,,,32157,0,,,
match,mætʃ,n. lighter consisting of a thin piece of wood or cardboard tipped with combustible chemical; ignites with friction\nn. a formal contest in which two or more persons or teams compete\nn. a burning piece of wood or cardboard\nn. an exact duplicate,"n. 比赛, 火柴, 对手\nvt. 使相配, 使比赛, 与...竞争\nvi. 结婚, 相配\n[计] 比较",,5,1,zk gk toefl ielts,1097,1972,s:matches/d:matched/3:matches/i:matching/p:matched,,
mated,,"a. mated sexually\ns. used of gloves, socks, etc.\ns. of or relating to a marriage partner",成双的；成对的,,,,,0,42891,0:mate/1:dp/p:mated,,
mater,'meitә,n. an informal use of the Latin word for mother; sometimes used by British schoolboys or used facetiously,n. 母亲\n[医] 脑[脊]膜,,,,,40683,13387,s:maters,,
mates,,"n a pair of people who live together\nn the officer below the master on a commercial ship\nn a fellow member of a team\nn the partner of an animal (especially a sexual partner)\nn a person's partner in marriage\nn an exact duplicate\nn one of a pair\nn South American holly; leaves used in making a drink like tea\nn informal term for a friend of the same sex\nn South American tea-like drink made from leaves of a South American holly called mate\nn a chess move constituting an inescapable and indefensible attack on the opponent's king\nv engage in sexual intercourse\nv bring two objects, ideas, or people together\nv place an opponent's king under an attack from which it cannot escape and thus ending the game\nv twist together or entwine into a confusing mass\nv change texture so as to become matted and felt-like","n. 好朋友；伴侣牌, 伙伴",,,,,31345,0,0:mate/1:s3,,
matey,'meiti,s (used colloquially) having the relationship of friends or pals,"a. 易为人亲近的, 融洽的\nn. 伙伴, 朋友",,,,,18369,45403,,,
maths,mæθs,n a science (or group of related sciences) dealing with the logic of quantity and shape and arrangement\nn a science (or group of related sciences) dealing with the logic of quantity and shape and arrangement,n. 数学,,1,,cet4 cet6 ky,5774,38684,,,
matin,'mætin,"n. Morning.\nn. Morning worship or service; morning prayers or songs.\nn. Time of morning service; the first canonical hour in the\n   Roman Catholic Church.\na. Of or pertaining to the morning, or to matins; used in the\n   morning; matutinal.","n. 早课, 晨祷, 朝课\na. 早课的, 晨祷的",,,,,49450,0,,,
Matra,mɑ:trә,,[音]马特勒(印度音乐的节拍单位),,,,,42157,0,s:matras,,
Matta,,,"n. (Matta)人名；(英、意、西、葡、刚(金))玛塔 (女名), 马塔；(日)全田(姓)",,,,,31746,0,,,
matte,mæt,n. a mixture of sulfides that forms when sulfide metal ores are smelted,"a. 表面粗糙的\nn. 无光粗糙层, 冰铜",,,,,30423,16469,s:mattes,,
matzo,'mɑ:tsәu,n. brittle flat bread eaten at Passover,"(pl. matzot, matzoth, matzos)(=matsah)犹太逾越节薄饼(逾越节期间犹太人所吃的一种不发酵的硬面饼)",,,,,0,25715,s:matzos,,
maude,,,abbr. 莫尔斯自动译码器（Morse Automatic Decoder）,,,,,17427,0,,,
Maule,,n. The common mallow.,莫尔（人名）,,,,,45820,0,s:maules,,
Maura,'mɔ:rә,,n. 莫拉(Mary的异体)(f.),,,,,18214,0,,,
Mauro,,,莫罗（人名）,,,,,39879,0,,,
mauve,mәuv,n. a moderate purple\ns. of a pale to moderate greyish violet color,"n. 苯胺紫, 淡紫色\na. 淡紫色的",,1,,gre,15423,20146,s:mauves,,
maven,'meivin,n someone who is dazzlingly skilled in any field,"n. 内行, 专家",,,,gre,0,21165,s:mavens,,
mavis,'meivis,n common Old World thrush noted for its song,n. 歌鸫,,,,,17445,0,,,
Maxey,,,n. (Maxey)人名；(英)马克西,,,,,46663,0,,,
Maxim,'mæksim,n. a saying that is widely accepted on its own merits\nn. English inventor (born in the United States) who invented the Maxim gun that was used in World War I (1840-1916),"n. 格言, 座右铭\n[法] 格言, 准则, 原则",,1,,toefl gre,13658,15719,s:maxims,,
Mayan,'mɑ:jәn,n. a member of an American Indian people of Yucatan and Belize and Guatemala who had a culture (which reached its peak between AD 300 and 900) characterized by outstanding architecture and pottery and astronomy,"a. 马雅人的, 马雅语的\nn. 马雅人, 马雅语",,,,,36782,15922,s:mayans,,
maybe,'meibi:,r by chance,"adv. 也许, 大概\nn. 可能性",,4,1,zk gk,955,383,,,
mayer,'meiә,n. United States physicist (born in Germany) noted for her research on the structure of the atom (1906-1972)\nn. United States filmmaker (born in Russia) who founded his own film company and later merged with Samuel Goldwyn (1885-1957),[医] 迈尔(热容单位),,,,,17024,0,,,
Mayes,,,梅斯（人名）,,,,,40864,0,,,
Mayle,,,n. (Mayle)人名；(英)梅尔,,,,,42100,0,,,
MAYNE,,,梅恩,,,,,29955,0,,,
mayor,'mєә,n. the head of a city government,n. 市长\n[法] 市长,,3,1,cet4 cet6 ky,3215,2486,s:mayors,,
mazda,'mæzdә,,n. 马自达汽车,,,,,24418,0,,,
mccoy,mә'kɔi,,n. 本人；真品,,,,,26744,0,,,
Mcgee,,,[计] 麦克吉,,,,,26141,0,,,
McKay,,,"n. (McKay)人名；(英)麦凯\n麦凯, 盖尔语姓氏的英语形式, 来源于人名, 含义是“火”（人名）（苏格兰人、爱尔兰人姓氏）",,,,,17076,0,,,
McKee,,,n. (McKee)人名；(英)麦基,,,,,25608,0,,,
McNab,,,n. (McNab)人名；(英)麦克纳布,,,,,30607,0,,,
McRae,,,n. (McRae)人名；(英)麦克雷,,,,,28891,0,,,
Meade,,n. English economist noted for his studies of international trade and finance (1907-1995)\nn. United States general in charge of the Union troops at the Battle of Gettysburg (1815-1872),n. 美国米德（望远镜品牌）；米德（人名）,,,,,26320,0,,,
Meads,,n United States anthropologist noted for her claims about adolescence and sexual behavior in Polynesian cultures (1901-1978)\nn United States philosopher of pragmatism (1863-1931)\nn made of fermented honey and water,n. (Meads)人名；(英)米兹,,,,,39943,0,0:mead/1:s,,
meals,,n the food served and eaten at one time\nn any of the occasions for eating food that occur by custom or habit at more or less fixed times\nn coarsely ground foodstuff; especially seeds of various cereal grasses or pulse,n. 膳食；谷类（meal的复数）,,,,ielts,0,0,0:meal/1:s,,
mealy,'mi:li,a. containing meal or made of meal,a. 粉状的,,,,,42132,28901,t:mealiest,,
means,mi:nz,n. how a result is obtained or an end is achieved\nn. an instrumentality for accomplishing some end\nn. considerable capital (wealth or income),"n. 方法, 手段, 工具, 财产, 收入\n[经] 方法, 手段, 工具; 意谓",,4,1,gk cet4 cet6 ky toefl ielts,1033,0,0:mean/1:3,,
meant,ment,v mean or intend to express or convey\nv have as a logical consequence\nv denote or connote\nv have in mind as a purpose\nv have a specified degree of importance\nv intend to refer to\nv destine or designate for a certain purpose,mean的过去式和过去分词,,2,,,21807,0,0:mean/1:pd,,
meany,,n. United States labor leader who was the first president of the AFL-CIO (1894-1980),"n. 小气鬼, 卑鄙家伙",,,,,0,38341,s:meanies,,
Meath,mi:θ,n. Alt. of Meathe,米斯郡[爱尔兰东部伦斯特省的郡],,,,,38321,0,,,
meaty,'mi:ti,"a. like or containing meat; let's have a meaty meal""\ns. being on topic and prompting thought","a. 肉的, 似肉的, 多肉的",,,,,19706,14790,r:meatier,,
Meaux,,,n. (Meaux)人名；(法)莫,,,,,48661,0,s:meaux/0:meaux/1:s,,
Mecca,'mekә,n. joint capital (with Riyadh) of Saudi Arabia; located in western Saudi Arabia; as the birthplace of Muhammad it is the holiest city of Islam\nn. a place that attracts many visitors,n. 麦加,,1,,,14686,13257,s:meccas,,
medal,'medl,n an award for winning a championship or commemorating some other event,"n. 奖牌, 勋章\nvt. 授勋予",,3,,gk cet4 cet6 ky ielts gre,4212,3451,s:medals,,
medea,mi:'diә,n. (Greek mythology) a princess of Colchis who aided Jason in taking the Golden Fleece from her father,"[医] 生殖器, 壮阳药",,,,,44288,0,,,
media,'mi:diә,n a means or instrumentality for storing or communicating information\nn the surrounding environment\nn an intervening substance through which signals can travel as a means for communication\nn (bacteriology) a nutrient substance (solid or liquid) that is used to cultivate micro-organisms\nn a liquid with which pigment is mixed by a painter\nn (biology) a substance in which specimens are preserved or displayed\nn an intervening substance through which something is achieved\nn a state that is intermediate between extremes; a middle position\nn someone who serves as an intermediary between the living and the dead\nn (usually plural) transmissions that are disseminated widely to the public\nn an occupation for which you are especially well suited,n. 媒体\n[计] 媒质,,4,1,gk cet4 cet6 toefl ielts,0,757,,,
medic,'medik,n. any of several Old World herbs of the genus Medicago having small flowers and trifoliate compound leaves,"n. 苜蓿属植物, 医师, 医科学生",,1,,,16377,11677,s:medics,,
Medoc,'meidɔk,n. red Bordeaux wine from the Medoc district of southwestern France,n. 一种红葡萄酒,,,,,31592,0,,,
megan,,,n. 梅根（女子名）,,,,,28428,0,,,
Mehdi,,,n. (Mehdi)人名；(伊朗、阿拉伯、塔吉)迈赫迪,,,,,44103,0,,,
Mehta,,,n. 梅塔（人名）,,,,,45649,0,,,
meier,,,n. 迈耶（女子名）,,,,,40947,0,,,
Melba,'melbә,n. Australian operatic soprano (1861-1931),梅尔巴(女子名) Nellie 内利梅抱(1861-1931)澳大利亚花腔女高音歌唱家,,,,,49957,0,,,
melee,me'lei,n. a noisy riotous fight,"n. 互殴, 激烈的论战, 混战",,,,,24237,19160,s:melees,,
Melia,,n. type genus of the Meliaceae: East Indian and Australian deciduous trees with leaves resembling those of the ash,n. (Melia)人名；(英)米利亚；(意、西)梅利亚\n楝属\n苦楝皮,,,,,41015,0,,,
Mello,,,n. (Mello)人名；(英、意、葡、法)梅洛；(西)梅略\n梅洛,,,,,29850,0,,,
Melly,,,n. (Melly)人名；(德、英)梅利,,,,,40863,0,s:mellies,,
melon,'melәn,n. any of numerous fruits of the gourd family having a hard rind and sweet juicy flesh\nn. any of various fruit of cucurbitaceous vines including: muskmelons; watermelons; cantaloupes; cucumbers,"n. 瓜, 甜瓜, 红利, 赃物\n[化] 三聚二氰亚胺",,1,,gk cet4 cet6 ky gre,12740,9886,s:melons,,
Memet,,,n. (Memet)人名；(土、罗、印尼)梅梅特,,,,,32484,0,,,
menai,,,n. (Menai)人名；(巴布)梅纳伊,,,,,39846,0,s:menai/0:menai/1:s,,
Menlo,,,门洛（美国地名）,,,,,31314,0,,,
mensa,'mensә,n. a faint constellation in the polar region of the southern hemisphere and containing part of the Large Magellanic Cloud,[医] Ж面,,,,,40867,0,,,
merci,mεr'si:,,int. 谢谢（法语）,,,,,43391,0,s:merci/0:merci/1:s,,
merck,,,"n. 默克公司（财富500强公司之一, 部所在地美国, 主要经营制药）",,,,,38934,0,,,
mercy,'mә:si,n. something for which to be thankful\nn. alleviation of distress; showing great kindness toward the distressed,"n. 仁慈, 宽恕, 慈悲, 怜悯, 幸运\n[法] 权宜处置权, 决定权, 宽恕",,2,,gk cet4 cet6 ky ielts,4991,5244,s:mercies,,
merde,mεrd,,n. [法语]；粪便；污秽；排泄物\na. 脏的；污秽的\ninterj. 呸![表示厌恶和愤怒的感叹语],,,,,44127,0,,,
merge,mә:dʒ,v become one\nv mix together different elements\nv join or combine,"vt. 使合并, 使消失, 吞没\nvi. 合并, 渐渐消失\n[计] 合并",,2,,cet6 ky toefl ielts,4687,5365,d:merged/p:merged/i:merging/3:merges,,
merit,'merit,n. any admirable quality or attribute,"n. 优点, 功绩, 价值, 功过, 真相\nvt. 值得\nvi. 应受",,2,,cet4 cet6 ky toefl ielts gre,3641,4501,s:merits/3:merits/p:merited/d:merited/i:meriting,,
Merle,m\\\\:l,n common black European thrush,n. 默尔（男子名）,,,,,38688,0,,,
merry,'meri,s full of or showing high-spirited merriment\ns offering fun and gaiety\ns quick and energetic,"a. 快乐的, 愉快的, 嬉戏作乐的",,2,,gk cet4 cet6 ky,7649,7420,r:merrier/t:merriest,,
Meryl,,,n. 梅丽尔（女子名）,,,,,17829,0,,,
mesic,'mi:zik,a. having or characterized by moderate or a well-balanced supply of moisture,a. 栖于湿地的,,,,,0,41465,,,
meson,'mezɒn,n. an elementary particle responsible for the forces in the atomic nucleus; a hadron with a baryon number of 0,n. 介子\n[化] 介子,,,,,0,34396,s:mesons,,
messr,,,abbr. multi-spectral electronic self-scanning radiometer 多频谱电子自扫描辐射计,,,,,48775,0,,,
messy,'mesi,s. dirty and disorderly,"a. 散乱的, 污秽的, 麻烦的",,1,,gk toefl,9558,6651,r:messier,,
metal,'metәl,v. cover with metal,"n. 金属, 金属制品, 合金, 本质, 质料\na. 金属制的\nvt. 以金属覆盖",,3,1,zk gk cet4 cet6 ky ielts,1668,1574,s:metals/i:metaling/p:metaled/3:metals/d:metaled,,
meter,'mi:tә,n. the basic unit of length adopted under the Systeme International d'Unites (approximately 1.094 yards)\nn. any of various measuring instruments for measuring a quantity\nn. (prosody) the accent in a metrical foot of verse\nn. rhythm as given by division into parts of equal duration,"n. 米, 公尺, 仪表, 计量器\nvt. 以仪表计量",,2,,,7042,3024,s:meters/d:metered/3:meters/i:metering/p:metered,,
metre,'mi:tә,n the basic unit of length adopted under the Systeme International d'Unites (approximately 1.094 yards)\nn (prosody) the accent in a metrical foot of verse\nn rhythm as given by division into parts of equal duration,"n. 公尺, 格律, 韵律\n[医] 米, 公尺",,3,1,zk gk cet4 cet6 ky,2099,0,s:metres,,
metro,'metrәu,n. an electric railway operating below the surface of the ground (usually in a city),n. 地铁,,1,,,12275,7110,s:metros,,
meyer,,,"n. 迈耶（日耳曼语, 指首席侍从或农夫）",,,,,12771,0,,,
mezzo,'metsәu. 'meddzɔ:,n a soprano with a voice between soprano and contralto\nn the female singing voice between contralto and soprano,a. （意）一半的；中央的,,,,,0,33539,,,
Miami,mai'æmi,n. a member of the extinct Algonquian people formerly living in northern Indiana and southern Michigan\nn. a city and resort in southeastern Florida on Biscayne Bay; the best known city in Florida; a haven for retirees and a refuge for Cubans fleeing Castro,n. 迈阿密,,,,,10150,0,,,
miaow,mi'au,n the sound made by a cat (or any sound resembling this)\nv make a cat-like sound,n. 猫叫声\nvi. 猫叫,,,,,35428,0,s:miaows/i:miaowing/p:miaowed/3:miaows/d:miaowed/f:miaows,,
