word,phonetic,definition,translation,pos,collins,oxford,tag,bnc,frq,exchange,detail,audio
dried,draid,s. not still wet\ns. preserved by removing natural moisture,a. 弄干了的,,2,,,6033,4382,0:dry/1:dp/p:dried/d:dried,,
drier,'draiә,"n a substance that promotes drying (e.g., calcium oxide absorbs water and is used to remove moisture)\nn an appliance that removes moisture\na free from liquid or moisture; lacking natural or normal moisture or depleted of water; or no longer wet\ns humorously sarcastic or mocking\na lacking moisture or volatile components\na opposed to or prohibiting the production and sale of alcoholic beverages\na not producing milk\na (of liquor) having a low residual sugar content because of decomposition of sugar during fermentation\na without a mucous or watery discharge; a small child with a dry nose""\ns not shedding tears\ns lacking interest or stimulation; dull and lifeless\ns used of solid substances in contrast with liquid ones\ns unproductive especially of the expected results\ns having no adornment or coloration\ns (of food) eaten without a spread or sauce or other garnish\ns having a large proportion of strong liquor\ns lacking warmth or emotional involvement\ns practicing complete abstinence from alcoholic beverages; I happen to be teetotal""","n. 干燥机, 干燥剂\n[化] 干燥剂; 催干剂; 干燥设备; 干燥器; 烘缸",,,,gk,19790,22822,0:dry/1:r/s:driers,,
drift,drift,n. a force that moves something along\nn. the gradual departure from an intended course due to external influences (as a ship or plane)\nn. a process of linguistic change over a period of time\nn. a large mass of material that is heaped up by the wind or by water currents,"n. 漂流物, 漂流, 动向\nv. (使)漂流",,3,,cet4 cet6 ky toefl ielts,3522,3599,p:drifted/i:drifting/d:drifted/s:drifts/3:drifts,,
drill,dril,"n. a tool with a sharp point and cutting edges for making holes in hard materials (usually rotating rapidly or by repeated blows)\nn. similar to the mandrill but smaller and less brightly colored\nn. (military) the training of soldiers to march (as in ceremonial parades) or to perform the manual of arms\nv. train in the military, e.g., in the use of weapons","n. 钻孔机, 钻子, 播种机, 粗斜纹布\nv. 训练, 钻孔",,2,,gk cet4 cet6 ky toefl ielts gre,5299,4760,i:drilling/s:drills/d:drilled/p:drilled/3:drills,,
drily,'draili,r in a dry laconic manner,"adv. 干燥地, 不加渲染地, 冷冰冰地, 枯燥地",,,,,10944,32062,,,
drink,driŋk,n. a single serving of a beverage\nn. the act of drinking alcoholic beverages to excess\nn. any large deep body of water\nv. take in liquids,"n. 饮料, 酒\nv. 喝, 喝酒",,4,1,zk gk,1284,1232,s:drinks/i:drinking/p:drank/d:drunk/3:drinks,,
drive,draiv,n. the act of applying force to propel something\nn. a mechanism by which force or power is transmitted in a machine\nn. the trait of being highly motivated\nn. hitting a golf ball off of a tee with a driver,"n. 驾车, 快车道, 推进力, 驱动, 动力, 击球, 驱动器\nvt. 开车, 驱使, 推动, 驾驶\nvi. 开车, 猛击, 飞跑\n[计] 驱动器",,5,1,zk gk,640,490,p:drove/d:driven/i:driving/3:drives/s:drives,,
droid,drɔid,,n. 机器人,,,,,0,27327,s:droids,,
droit,drɒit,"n. A right; law in its aspect of the foundation of rights;\n   also, in old law, the writ of right.","n. 权利, 所有权",,,,,0,43619,3:droits/s:droits,,
droll,drɒl,s. comical in an odd or whimsical manner,"a. 好笑的, 滑稽的, 逗趣的",,,,gre,24892,23727,3:drolls,,
drone,drәun,n. stingless male bee in a colony of social bees (especially honeybees) whose sole function is to mate with the queen\nn. an aircraft without a pilot that is operated by remote control\nn. a pipe of the bagpipe that is tuned to produce a single continuous tone\nv. make a monotonous low dull sound,"n. 雄蜂, 懒惰者, 嗡嗡的声音, 无人驾驶飞机(或船)\nvi. 嗡嗡作声, 混日子\nvt. 低沉地说",,1,,gre,16178,11442,p:droned/s:drones/3:drones/d:droned/i:droning,,
drool,dru:l,n. saliva spilling from the mouth,"vi. 流口水, 淌, 胡说八道\nvt. 从嘴淌下, 过分动感情地表示\nn. 口水, 胡说",,,,,21477,15812,i:drooling/p:drooled/d:drooled/3:drools/s:drools,,
droop,dru:p,v. hang loosely or laxly,"vi. 下垂, 消沉\nvt. 使下垂\nn. 低垂, 消沉",,1,,gre,16562,15135,p:drooped/i:drooping/3:droops/d:drooped/s:droops,,
dross,drɒs,n worthless or dangerous material that should be removed\nn the scum formed by oxidation at the surface of molten metals,"n. 浮渣, 碎屑, 渣滓\n[化] 浮渣",,,,gre,32850,35186,,,
drove,drәuv,n. a group of animals (a herd or flock) moving together\nn. a moving crowd\nn. a stonemason's chisel with a broad edge for dressing stone,n. 畜群\ndrive的过去式,,,,gre,18464,14747,0:drive/1:p/s:droves/i:droving,,
drown,draun,"v. get rid of as if by submerging\nv. die from being submerged in water, getting water into the lungs, and asphyxiating\nv. kill by submerging in water","vi. 淹死\nvt. 把...淹死, 淹没",,2,,gk cet4 cet6 ky ielts,4492,4927,d:drowned/p:drowned/i:drowning/3:drowns,,
drugs,,n a substance that is used as a medicine or narcotic\nv administer a drug to\nv use recreational drugs,"n. 毒品, 药物",,,,ielts,0,0,1:s3/0:drug,,
druid,'dru:id,n. a pre-Christian priest among the Celts of ancient Gaul and Britain and Ireland,"n. 巫师, 占卜者, 祭师",,1,,,17154,28278,s:druids,,
drunk,drʌŋk,n. someone who is intoxicated,a. 喝醉了的\ndrink的过去式,,2,1,gk cet4 cet6 ky,4187,3701,0:drink/1:dp/d:drunk/s:drunks/r:drunker/p:drunk,,
Drury,'drjәri,,"lane 特鲁里街(伦敦西区街名,曾以剧场集中著称)",,,,,20617,0,,,
druze,dru:z,n. an adherent of an esoteric monotheistic religious sect living in the relative security of the mountains of Syria and Lebanon who believes that Al-hakim was an incarnation of God,"n. 德鲁士(古罗马将军)\nn. [矿] 晶簇, 晶洞\nn. [医] 鼻疽",,,,,42760,0,,,
dryad,'draiәd,n. a deity or nymph of the woods,n. 树神,,,,,42759,0,s:dryads,,
dryer,'draiә,n. an appliance that removes moisture,"n. 干衣机, 干燥剂\n[化] 干燥剂; 催干剂; 干燥器; 干燥设备; 烘箱",,1,,,15885,9605,s:dryers,,
dryly,'draili,r in a dry laconic manner,"adv. 冷淡地, 枯躁无味地",,,,,25051,15963,,,
Duane,dwein; du:'ein,,n. 杜安（男子名）,,,,,34846,0,,,
dubai,'dju:bai,n. port city in the United Arab Emirates on the Persian Gulf,n. 迪拜（阿拉伯联合酋长国的酋长国之一）；迪拜港（阿拉伯联合酋长国港市）,,,,,22504,0,,,
ducal,'dju:kәl,a. of or belonging to or suitable for a duke,"a. 公爵的, 象公爵的, 公爵领地的",,,,,17738,35555,,,
ducat,'dʌkәt,n. formerly a gold coin of various European countries,"入场券, 门票",,,,,42066,33100,s:ducats,,
duchy,'dʌtʃi,n. the domain controlled by a duke or duchess,"n. 公爵领地, 公国, 直辖领地",,1,,,8345,32464,s:duchies,,
ducky,'dʌki,n a special loved one,"a. 极好的, 可爱的, 令人愉快的",,,,,47431,33632,s:duckies,,
duell,,, [人名] 迪尤尔,,,,,36589,0,i:duelling/p:duelled,,
Duffy,'dʌfi,,"n. 达菲（姓氏, 英国女歌手名）",,,,,16641,0,,,
dully,'dʌli,r. without liveliness\nr. without luster or shine,"adv. 钝地, 迟钝地, 不清楚地",,,,cet6,26537,22466,,,
dulux,'dʌlәks,,醇酸树脂,,,,,46593,0,,,
dumas,dju'mɑ:,n. French writer remembered for his swashbuckling historical tales (1802-1870),[医] 足雅司病,,,,,26168,0,0:duma/1:s,,
dumbo,'dʌmbәu,,[美口]救护(搜索)飞机,,,,,45277,34529,s:dumbos,,
dummy,'dʌmi,n. a person who does not talk\nn. a figure representing the human form\nv. make a dummy of\ns. having the appearance of being real but lacking capacity to function,"n. 傀儡, 假人, 仿制品\na. 虚设的, 假的, 名义上的",,1,,gre,9900,11288,s:dummies/p:dummied/d:dummied/i:dummying/3:dummies,,
dumpy,'dʌmpi,a. resembling a garbage dump\ns. short and plump,"a. 矮胖的, 粗短的",,,,,23090,28518,r:dumpier,,
dunce,dʌns,n. a stupid person; these words are used to express a low opinion of someone's intelligence,"n. 智力迟钝的学生, 傻瓜",,,,toefl gre,34321,27716,s:dunces,,
dunne,dʌn,,n. 邓恩（姓氏）,,,,,24121,0,,,
duomo,'dwɔ:mɔ:,n the principal Christian church building of a bishop's diocese,"n. 大教堂, 中央寺院",,,,,31213,35176,,,
duped,du:pt,v fool or hoax,v. 欺骗或哄骗某人（做某事）( dupe的过去式和过去分词 ),,,,,0,45751,0:dupe/1:dp/d:duped/p:duped,,
dural,djuә'ræl,a. of or relating to the dura mater,a. 硬脑膜的\n[医] 硬脑[脊]膜的,,,,,0,43941,,,
Duran,,,n. 榴梿\nn. (Duran)人名；(法)迪朗；(德、英、意、土、罗、捷、塞)杜兰,,,,,28929,0,s:durans,,
Durex,'du:reks,,"杜雷克铜锡合金, 烧结石墨青铜",,,,,41228,0,,,
Duroc,'djuәrɔk,,n. 杜洛克猪(美国于19 世纪培育的一种脂肪型大红猪),,,,,31936,0,,,
durum,'djuәrәm,"n. wheat with hard dark-colored kernels high in gluten and used for bread and pasta; grown especially in southern Russia, North Africa, and northern central North America",n. 硬粒小麦,,,,,0,39368,,,
dusky,'dʌski,s. lighted by or as if by twilight,"a. 微暗的, 暗淡的, 暗黑色的, 多黑影的, 黑黝黝的, 微黑色的, 忧郁的",,,,toefl,21939,18555,r:duskier,,
dusty,'dʌsti,s. covered with a layer of dust,"a. 灰尘多的, 无聊的, 含糊的, 粉末状的",,1,,gk,6602,5298,r:dustier,,
Dutch,dʌtʃ,n. the people of the Netherlands\nn. the West Germanic language of the Netherlands\na. of or relating to the Netherlands or its people or culture,"n. 荷兰人, 荷兰语\na. 荷兰的",,,,,3191,4059,,,
Duval,,,杜瓦尔（男子名）,,,,,30372,0,,,
duvet,du:'vei,n a soft quilt usually filled with the down of the eider,n. 羽绒被,,1,,,12450,26843,s:duvets,,
dwarf,dwɒ:f,n. a person who is markedly small\nn. a plant or animal that is atypically small\nv. check the growth of,"n. 矮子, 侏儒\nv. (使)变矮小",,2,,cet6 ky toefl ielts gre,6218,6855,s:dwarfs/d:dwarfed/p:dwarfed/3:dwarfs/i:dwarfing,,
dweeb,dwi:b,n an insignificant student who is ridiculed as being affected or boringly studious,"n. <俚>呆子, 怪人",,,,,0,33769,s:dweebs,,
dwell,dwel,v. originate (in)\nv. exist or be situated within,"vi. 居住, 居住(于), 存在(于)",,1,,cet6 ky toefl ielts,7576,7180,d:dwelt/3:dwells/p:dwelt/i:dwelling,,
Dwyer,,,德怀尔,,,,,26980,0,,,
Dyfed,'dʌved,,德韦达郡[英国威尔士郡名],,,,,22034,0,,,
dying,'daiiŋ,a. in or associated with the process of passing from life or ceasing to be,"a. 垂死的\n[法] 快要死的, 垂死的, 临终的",,2,1,cet4 cet6,5268,4582,0:die/1:i/i:dying,,
dylan,,n. United States songwriter noted for his protest songs (born in 1941)\nn. Celtic god of the waves; son of Arianrhod,n. 狄伦（男子名）,,,,,12704,0,,,
Dyson,,,戴森（人名）,,,,,13444,0,s:dysons,,
eager,'i:gә,a. having or showing keen interest or intense desire or impatient expectancy,"a. 热心的, 渴望的, 热望的",,3,,gk cet4 cet6 ky toefl,4501,3123,,,
eagle,'i:gl,n. any of various large keen-sighted diurnal birds of prey noted for their broad wings and strong soaring flight\nn. (golf) a score of two strokes under par on a hole\nn. a former gold coin in the United States worth 10 dollars\nn. an emblem representing power,"n. 鹰, 鹰状标饰",,2,,gk cet4 cet6 ky ielts,3850,45890,s:eagles/p:eagled/d:eagled/i:eagling/3:eagles/f:eagles,,
Eames,,n. United States designer noted for an innovative series of chairs (1907-1978),埃姆斯,,,,,42756,0,0:eame/1:3s,,
Eamon,,,"埃蒙（男子名, 爱尔兰语）, 含义是“愉快的保护”（happy protection）\n艾曼（人名）\n伊蒙（人名）",,,,,39238,0,,,
eared,iәd,a. having ears (or appendages resembling ears) or having ears of a specified kind; often used in combination,"a. 有...耳的, 有把的, 有穗的",,,,,0,41060,,,
Earle,,,厄尔（人名）,,,,,17327,0,,,
Earls,,n a British peer ranking below a marquess and above a viscount,n. 伯爵（earl的复数）,,,,,16034,0,0:earl/1:s,,
early,'ә:li,a. at or near the beginning of a period of time or course of events or before the usual or expected time\na. being or occurring at an early stage of development\ns. belonging to the distant past\ns. very young,"a. 早的, 早熟的\nadv. 很早, 初",,5,1,zk gk,245,365,r:earlier/t:earliest,,
earth,ә:θ,n. the 3rd planet from the sun; the planet we live on\nn. the loose soft material that makes up a large part of the land surface\nn. the abode of mortals (as contrasted with Heaven or Hell)\nn. once thought to be one of four elements composing the universe (Empedocles),"n. 地球, 泥土, 世界, 尘世\nvt. 埋入土中, 赶入洞内\nvi. 躲入洞内",,4,1,zk gk,1026,1547,s:earths/d:earthed/i:earthing/p:earthed/3:earths,,
easel,'i:zәl,n. an upright tripod for displaying something (usually an artist's canvas),"n. 画架, 黑板架",,,,gre,16378,11660,s:easels,,
eason,,,n. 伊森（男子名）,,,,,49983,0,s:easons,,
eater,'i:tә,n. someone who consumes food for nourishment\nn. any green goods that are good to eat,"n. 吃...的人, 生吃的水果, 美味的水果",,1,,,15051,12208,s:eaters,,
eaton,'i:tn,,n. 伊顿（姓氏））,,,,,15764,0,,,
Ebert,,,埃伯特（人名）,,,,,31162,0,,,
ebony,'ebәni,n. hard dark-colored heartwood of the ebony tree; used in cabinetwork and for piano keys\nn. tropical tree of southern Asia having hard dark-colored heartwood used in cabinetwork,n. 乌木\na. 乌木制的,,,,,22348,15149,s:ebonies,,
Ebury,,,n. (Ebury)人名；(英)伊伯里,,,,,37957,0,,,
eclat,,n. brilliant or conspicuous success or effect,"n. 大成功, 喝采",,,,toefl,0,42156,,,
Ecole,,,n. (Ecole)人名；(法)埃科勒\nabbr. 初期教会的在线百科全书（Early Church On-line Encyclopedia）,,,,,37460,0,s:ecoles,,
Ecoli,,,大肠（杆）菌（产生于大肠的杆状菌）,,,,,31874,0,,,
eddie,'edi,,n. 埃迪（男子名）,,,,,5180,0,,,
edema,i(:)'di:mә,"n. swelling from excessive accumulation of watery fluid in cells, tissues, or serous cavities","n. 水肿, 浮肿\n[医] 水肿",,,,,0,21334,,,
edgar,'ed^ә,n. the younger brother of Edwy who became king of Northumbria when it renounced Edwy; on Edwy's death he succeeded to the throne of England (944-975),n. 埃德加（男子名）,,,,,7985,0,,,
edged,edʒd,s. having a specified kind of border or edge\ns. having a cutting edge or especially an edge or edges as specified; often used in combination,a. 有某种或几种刃的,,2,,,33757,34609,0:edge/1:pd/d:edged/p:edged,,
edict,'i:dikt,n. a formal or authoritative proclamation,"n. 布告, 法令\n[经] 布告, 法令",,1,,gre,18967,15238,s:edicts,,
edify,'edifai,v make understand,"vt. 启迪, 熏陶, 教诲",,,,toefl gre,37135,28444,i:edifying/d:edified/p:edified/3:edifies,,
edith,'i:diθ,,n. 伊迪丝（女子名）,,,,,9069,0,,,
educe,i'dju:s,v. deduce (a principle) or construe (a meaning),"vt. 引出, 推断出, 使显出",,,,toefl,0,0,d:educed/i:educing/p:educed/3:educes,,
edwin,'edwin,n. king of Northumbria who was converted to Christianity (585-633),"n. 爱德温（男子名, 义为繁荣、富有）",,,,,9073,0,,,
eejit,,," （代表一些人对idiot的读音方式）白痴, 傻瓜",,,,,0,45959,s:eejits,,
eerie,'iәri,s. suggestive of the supernatural; mysterious\ns. inspiring a feeling of fear; strange and frightening,"a. 怪诞的, 可怕的, 奇异的, 令人迷惑不解的",,1,,gre,11997,8199,,,
Eggar,'e^ә(r),n. moth having nonfunctional mouthparts as adults; larvae feed on tree foliage and spin egg-shaped cocoons,"幼虫食叶子的蛾类,搜集鸡蛋的人",,,,,28419,0,s:eggars,,
egret,'i:gret,n. any of various usually white herons having long plumes during breeding season,n. 白鹭,,,,,47298,19943,s:egrets,,
Egypt,'i:dʒipt,n. a republic in northeastern Africa known as the United Arab Republic until 1971; site of an ancient civilization that flourished from 2600 to 30 BC,n. 埃及,,,,,3297,0,,,
eider,'aidә,n. duck of the northern hemisphere much valued for the fine soft down of the females,"n. 绒鸭, 绒鸭绒",,,,,29419,36467,s:eiders,,
Eiger,,,n. 艾格尔峰（位于瑞士中南部）,,,,,39084,0,,,
eight,eit,n. the cardinal number that is the sum of seven and one\ns. being one more than seven,"num. 八, 八个",,5,,zk gk,579,739,,,
eject,i'dʒekt,"v. put out or expel from a place\nv. leave an aircraft rapidly, using an ejection seat or capsule","vt. 逐放, 放逐, 喷射\n[化] 排出",,1,,cet6 ky toefl ielts,11234,10924,d:ejected/p:ejected/i:ejecting/3:ejects,,
ejido,e'hi:ðәj,,n. (墨西哥的)合作农场,,,,,0,27825,s:ejidos,,
eland,'i:lәnd,n. either of two large African antelopes of the genus Taurotragus having short spirally twisted horns in both sexes,n. 大羚羊,,,,,0,28362,s:elands,,
elate,i'leit,v. fill with high spirits; fill with optimism,"vt. 使兴高采烈, 使得意",,,,,0,40869,d:elated/i:elating/p:elated/3:elates,,
elbow,'elbәu,n. hinge joint between the forearm and upper arm and the corresponding joint in the forelimb of a quadruped\nn. a sharp bend in a road or river\nn. a length of pipe with a sharp bend in it\nn. the part of a sleeve that covers the elbow joint,"n. 手肘, 弯头, 扶手\nv. 用手肘推开, 推挤",,2,1,cet4 cet6 ky toefl ielts gre,4155,3512,s:elbows/p:elbowed/i:elbowing/d:elbowed/3:elbows,,
elder,'eldә,n. a person who is older than you are\nn. any of numerous shrubs or small trees of temperate and subtropical northern hemisphere having white flowers and berrylike fruit\nn. any of various church officers\ns. used of the older of two persons of the same name especially used to distinguish a father from his son,"n. 年长者, 老人, 前辈\na. 年长的, 资深的",,2,,zk gk cet4 ky ielts,5602,4056,r:elder/0:elder/1:r/s:elders,,
Eldon,,,埃尔登（人名）,,,,,28718,0,,,
elect,i'lekt,v. select by a vote for an office or membership\nv. choose\ns. selected as the best\ns. elected but not yet installed in office,"n. 当选人, 被选的人\na. 被选的, 选出的\nvt. 选举, 选择\nvi. 作选择",,4,1,gk cet4 ky,1794,2265,d:elected/p:elected/i:electing/3:elects,,
elegy,'elidʒi,n. a mournful poem; a lament for the dead,"n. 悲歌, 哀歌, 挽歌",,,,gre,24307,19616,s:elegies,,
elena,"ә'leinә,'elәnә",,"n. 埃琳娜（女子名, 等于Helen）",,,,,17602,0,,,
elfin,'elfin,s. suggestive of an elf in strangeness and otherworldliness\ns. small and delicate\na. relating to or made or done by or as if by an elf,"a. 小妖精的, 象小妖精的\nn. 小精灵, 矮人, 淘气鬼",,,,,37334,0,s:elfins,,
Elgar,'el^ә,n. British composer of choral and orchestral works including two symphonies as well as songs and chamber music and music for brass band (1857-1934),埃尔加(姓氏),,,,,16832,0,,,
elgin,'elgin,,"n. 埃尔金大理石雕；埃尔金（人名, 或地名, 指美国伊利诺伊州的一个城市）；爱而近（手表品牌名）",,,,,22019,0,,,
elias,i'laiәs,n English essayist (1775-1834),"n. 伊莱亚斯（希伯来先知, 等于Elijah）",,,,,17238,0,,,
elide,i'laid,v. leave or strike out,"vt. 省略(元音、辅音), 删去(字、句等), 取消",,,,,35121,28717,d:elided/3:elides/p:elided/i:eliding/s:elides,,
Eline,,,n. (Eline)人名；(法)埃利纳,,,,,11078,0,,,
eliot,'eljәt,n. British poet (born in the United States) who won the Nobel prize for literature; his plays are outstanding examples of modern verse drama (1888-1965)\nn. British writer of novels characterized by realistic analysis of provincial Victorian society (1819-1880),n. 艾略特（姓氏）,,,,,3767,0,,,
ELISA,,n an assay that relies on an enzymatic conversion reaction and is used to detect the presence of specific substances (such as enzymes or viruses or antibodies or bacteria),[化] 酶联免疫吸附测定,,,,,17987,0,,,
elise,e'li:z,,n. 伊莉斯（女子名）,,,,,13580,0,,,
elite,ei'li:t,n. a group or class of persons enjoying superior intellectual or social or economic status,"n. 精华, 精锐, 中坚分子",,2,,cet6 ky toefl ielts gre,4216,2735,s:elites,,
eliza,,,"n. 伊莱扎（女子名, Elizabeth的昵称）",,,,,17314,0,,,
ellen,'elin,,n. 埃伦（女子名）,,,,,5903,0,,,
ellie,'eli,,n. 埃莉（女子名）,,,,,7505,0,,,
ellis,'elis,n (Norse mythology) goddess of old age who defeated Thor in a wrestling match,"n. 埃利斯（男子名, 等于Elias）",,,,,5825,0,,,
elmer,'elmә,,n. 埃尔默（男子名）,,,,,36309,0,s:elmers,,
elope,i'lәup,v. run away secretly with one's beloved,"vi. 私奔, 潜逃\n[法] 私奔, 弃职, 逃亡",,,,,33534,22973,p:eloped/d:eloped/3:elopes/s:elopes/i:eloping,,
elsie,,,n. 埃尔希（女子名）,,,,,13089,0,,,
Elson,,,n. (Elson)人名；(俄)埃尔森；(英、葡)埃尔森,,,,,45098,0,,,
elton,'eltәn,,n. 埃尔顿（男子名）,,,,,12308,0,,,
elude,i'lu:d,"v. escape, either physically or mentally\nv. be incomprehensible to; escape understanding by","vt. 逃避, 规避, 把...难倒",,1,,toefl gre,11123,9267,d:eluded/p:eluded/3:eludes/i:eluding,,
elute,i'lju:t,"v. wash out with a solvent, as in chromatography",[医] 洗脱,,,,,31243,0,d:eluted/p:eluted/i:eluting/3:elutes,,
elven,,," 小精灵, 精灵族",,,,,0,32871,,,
elvin,,,n. 埃尔温（男子名）,,,,,39083,0,,,
elvis,,n street name for lysergic acid diethylamide,n. 埃尔维斯（男子名）,,,,,10645,0,,,
Elwyn,'elwin,,"n. 埃尔温（男子名, 等于Elwin）",,,,,45944,0,,,
email,'i:'meil,n (computer science) a system of world-wide electronic communication in which a computer user can compose a message at one terminal that can be regenerated at the recipient's terminal when the recipient logs in\nv communicate electronically on the computer,n. 电子信函,,,1,zk ielts,0,0,,,
embed,im'bed,"v. attach to, as a journalist to a military unit when reporting on a war","vt. 使插入, 使嵌入, 使深留脑中\n[计] 嵌入",,1,,ky toefl ielts gre,7054,6007,d:embedded/i:embedding/3:embeds/p:embedded,,
ember,'embә,n. a hot fragment of wood or coal that is left from a fire and is glowing or smoldering,"n. 灰烬, 余烬",,,,,16326,14931,s:embers,,
emcee,'em'si:,v. act as a master of ceremonies,"n. 司仪, 主持人\nvt. 担任...主持人, 主持",,,,,0,21970,i:emceeing/p:emceed/3:emcees/d:emceed/f:emcees,,
emend,i'mend,v. make improvements or corrections to,"vt. 修订, 校勘",,,,toefl gre,0,45301,d:emended/p:emended/i:emending/3:emends,,
emery,'emәri,n. a hard grey-black mineral consisting of corundum and either hematite or magnetite; used as an abrasive (especially as a coating on paper),n. 金刚砂\n[化] 金刚砂,,,,,23242,32234,,,
emile,ei'mi:l,n. the boy whose upbringing was described by Jean-Jacques Rousseau,"n. 埃米尔（男子名, 等于Emil）",,,,,23164,0,,,
emily,'emәli,,n. 埃米莉（女子名）,,,,,3613,0,,,
Emlyn,'emlin,,n. 埃姆林（男子名）,,,,,27096,0,,,
emmet,'emit,n social insect living in organized colonies; characteristically the males and fertile queen have wings during breeding season; wingless sterile females are the workers,n. 蚂蚁,,,,,45829,0,,,
Emmie,,,n. (Emmie)人名；(英)埃米(女子教名Emma的昵称),,,,,13660,0,,,
emote,i'mәut,"v. give expression or emotion to, in a stage or movie role","vi. 装模作样, 表现感情",,,,gre,0,31449,i:emoting/3:emotes/p:emoted/d:emoted,,
empty,'empti,n. a container that has been emptied\nv. make void or empty of contents\nv. become empty or void of its content\nv. remove,"a. 空的, 空虚的, 空腹的, 空洞的\nn. 空的东西, 空车\nvt. 倒空, 使变空, 使排出\nvi. 流空\n[计] 空",,3,1,zk gk toefl ielts,1735,1644,d:emptied/p:emptied/i:emptying/3:empties/s:empties/r:emptier/t:emptiest,,
enact,i'nækt,v. act out; represent or perform as if in a play,"vt. 制定法律, 扮演, 颁布\n[法] 法令, 法规, 条例",,2,,toefl gre,6524,4710,d:enacted/p:enacted/i:enacting/3:enacts,,
ender,,"n. One who, or that which, makes an end of something; as, the\n   ender of my life.",n. 安德（游戏中的人物名）；恩德（男子名）,,,,,39603,0,s:enders,,
endow,in'dau,v. give qualities or abilities to\nv. furnish with an endowment,"vt. 捐赠, 捐助, 赋予\n[法] 赠送财产给, 分给寡妇一份遗产, 授与",,1,,cet6 ky toefl ielts gre,8684,9907,d:endowed/p:endowed/i:endowing/3:endows,,
endue,in'dju:,v give qualities or abilities to,"vt. 授予, 赋予, 穿上",,,,toefl gre,0,0,d:endued/p:endued/i:enduing/3:endues,,
enema,'enimә,n. an injection of a liquid through the anus to stimulate evacuation; sometimes used for diagnostic purposes,"n. 灌肠剂\n[医] 灌肠法, 灌肠剂",,,,,17677,25615,s:enemas,,
enemy,'enimi,n. an opposing military force\nn. an armed adversary (especially a member of an opposing military force)\nn. any hostile group of people,"n. 敌人, 仇敌, 敌军\na. 敌人的",,3,1,zk gk cet4 ky,1860,1596,s:enemies,,
engel,,,"n. 恩格尔（恩格尔   	德国的统计学家）；英杰尔（日本品牌）",,,,,10830,0,s:engels/3:engels,,
enjoy,in'dʒɒi,v. derive or receive pleasure from; get enjoyment from; take pleasure in\nv. have benefit from\nv. have for one's benefit,"vt. 享受, 喜欢, 欣赏\n[法] 享受, 享有, 获得某种利益",,4,1,zk gk,685,881,p:enjoyed/i:enjoying/d:enjoyed/3:enjoys,,
Ennis,'enis,,n. 恩尼斯（男子名）,,,,,45005,0,,,
ennui,'ɒnwi:,n the feeling of being bored by something tedious,"n. 倦怠, 厌倦\n[医] 厌倦",,,,toefl gre,34569,24297,,,
enoch,'i:nɔk,,n. 伊诺克（男子名）,,,,,16721,0,,,
enoki,e'nəʊki:,,n. 朴蘑（产于日本北部）,,,,,0,45214,,,
enrol,in'rәul,v register formally as a participant or member,"vt. 登记, 使加入\nvi. 参军, 注册",,1,,,8506,0,d:enrolled/p:enrolled/i:enrolling/3:enrols,,
Ensor,'ensɔ:,,"恩索尔(①姓氏 ②James, 1860-1949, 比利时画家)",,,,,46988,0,,,
ensue,en'su:,"v issue or terminate (in a specified way, state, etc.); end","vi. 跟着发生, 继起\nvt. 追求",,1,,cet6 ielts gre,8586,9538,p:ensued/3:ensues/d:ensued/i:ensuing,,
