word,phonetic,definition,translation,pos,collins,oxford,tag,bnc,frq,exchange,detail,audio
aargh,ɑ:,, 啊 ,,,,,18154,0,,,
aaron,'eәrәn,n. United States professional baseball player who hit more home runs than Babe Ruth (born in 1934)\nn. (Old Testament) elder brother of Moses and first high priest of the Israelites; created the golden calf,"n. 亚伦（男子名）；[圣经]亚伦（摩西之兄, 犹太教的第一祭司长）",,,,,12804,0,,,
Ababa,,,n. (Ababa)人名；(塞)阿巴巴,,,,,17876,0,,,
aback,ә'bæk,r. having the wind against the forward side of the sails\nr. by surprise,"adv. 向后, 朝后, 突然, 船顶风地",,1,,,11826,12786,,,
abase,ә'beis,v cause to feel shame; hurt the pride of,"vt. 降低...的地位, 降低...的品格, 贬抑, 使谦卑",,,,gre,41733,41704,i:abasing/p:abased/3:abases/d:abased,,
abash,ә'bæʃ,v cause to be embarrassed; cause to feel self-conscious,"vt. 使不安, 使羞愧, 使困窘",,,,gre,48446,41079,d:abashed/i:abashing/p:abashed/3:abashes,,
abate,ә'beit,v. become less in amount or intensity,"vt. 减少, 减轻, 减弱, 废除, 打折扣\nvi. 减轻, 减弱, 减少, 失效, 被废除",,1,,toefl gre,13783,13243,d:abated/i:abating/p:abated/3:abates,,
abaya,ә'beijә,n. (Arabic) a loose black robe from head to toe; traditionally worn by Muslim women,"n. 毛织物, (阿拉伯式)长袍",,,,,0,37347,s:abayas,,
Abbas,,,"n. 阿巴斯（地名, 伊朗最大港口）；阿巴斯王朝",,,,,25818,0,,,
abbey,'æbi,n. a church associated with a monastery or convent\nn. a convent ruled by an abbess\nn. a monastery ruled by an abbot,n. 大修道院,,2,,,3572,17783,s:abbeys,,
abbot,'æbәt,n. the superior of an abbey of monks,"n. 男修道院院长, 大寺院男住持",,,,,9276,21439,s:abbots,,
Abdel,,,n. (Abdel)人名；(阿拉伯、哈萨、塔吉、吉尔、乌兹、阿塞、土库、乍、塞)阿卜杜勒,,,,,29282,0,,,
abdul,,,n. 阿卜杜勒（人名）,,,,,13220,0,,,
abhor,әb'hɒ:,v. find repugnant,"vt. 憎恶, 痛恨, 回避, 拒绝",,,,toefl gre,18438,16665,p:abhorred/3:abhors/d:abhorred/i:abhorring,,
abide,ә'baid,v dwell\nv put up with something or somebody unpleasant,"vi. 停留, 遵守, 居留, 继续下去\nvt. 忍受, 经受, 屈从于",,1,,cet6 ky toefl gre,9496,8457,i:abiding/3:abides/p:abided/d:abided,,
abode,ә'bәud,n any address at which you dwell more than temporarily\nn housing that someone is living in\nv dwell\nv put up with something or somebody unpleasant,"n. 住所, 住处\nabide的过去式和过去分词",,,,,14966,19221,1:pd/0:abide/s:abodes,,
abort,ә'bɒ:t,"n. the act of terminating a project or procedure before it is completed\nv. terminate before completion\nv. cease development, die, and be aborted\nv. terminate a pregnancy by undergoing an abortion","vi. 流产, 中途失败\nvt. 使流产, 使失败, 使中止",,1,,toefl ielts,13979,12402,d:aborted/p:aborted/i:aborting/3:aborts,,
about,ә'baut,s. on the move\nr. all around or on all sides\nr. in the area or vicinity\nr. used of movement to or among many different places or in no particular direction,"prep. 在...周围, 大约, 有关, 关于\nadv. 大约, 四处, 在附近, 周围",,5,1,zk gk,63,46,,,
above,ә'bʌv,n. an earlier section of a written text\ns. appearing earlier in the same text\nr. at an earlier place\nr. in or to a place that is higher,"prep. 在上方, 超出\nadv. 在上面\na. 上述的, 上面的",,4,1,zk gk,733,893,,,
abram,'eibrәm,,"n. 艾布拉姆（男子名, 等于Abraham）",,,,,41133,0,s:abrams/3:abrams,,
abuse,ә'bju:s.ә'bju:z,n. a rude expression intended to offend or hurt\nv. use foul or abusive language towards\nv. use wrongly or improperly or excessively,"n. 滥用, 虐待, 恶习, 辱骂\nvt. 滥用, 辱骂, 虐待",,4,1,gk cet4 cet6 ky toefl ielts gre,2352,1540,d:abused/s:abuses/i:abusing/3:abuses/p:abused,,
abyss,ә'bis,n. a bottomless gulf or pit; any unfathomable (or apparently unfathomable) cavity or chasm or void extending below (often used figuratively),"n. 深渊, 深邃, 地狱",,1,,toefl,14950,11847,s:abysses,,
Accra,ә'krɑ:,n. the capital and largest city of Ghana with a deep-water port,n. 阿克拉(加纳首都),,,,,40159,0,,,
ackee,'æki:,n. red pear-shaped tropical fruit with poisonous seeds; flesh is poisonous when unripe or overripe,西非荔枝果,,,,,0,46210,,,
Acker,'eikә,,"涡流, 海啸, 水的波纹",,,,,45209,0,s:ackers,,
acorn,'eikɒ:n,n. fruit of the oak tree: a smooth thin-walled nut in a woody cup-shaped base,"n. 橡树果实\n[机] 浆栎, 浆栎果",,,,gre,12485,15397,s:acorns,,
acrid,'ækrid,s strong and sharp\ns harsh or corrosive in tone,"a. 苦味的, 辛辣的, 讥讽的, 刻薄的\n[医] 辛辣的",,,,toefl gre,20185,18600,,,
actin,'æktin,n. one of the proteins into which actomyosin can be split; can exist in either a globular or a fibrous form,n. 肌动蛋白\n[化] 肌动蛋白,,,,,30531,28785,,,
acton,'æktәn,"n. A stuffed jacket worn under the mail, or (later) a jacket\n   plated with mail.",n. 铠衣,,,,,15853,0,,,
actor,'æktә,n. a theatrical performer\nn. a person who acts and gets things done,"n. 男演员, 行动者\n[医] 作用物, 反应物",,3,1,gk cet4 ky ielts,2390,1497,s:actors,,
acute,ә'kju:t,a. having or experiencing a rapid onset and short but severe course\ns. extremely sharp or intense\ns. having or demonstrating ability to recognize or draw fine distinctions\na. of an angle; less than 90 degrees,"a. 尖锐的, 敏锐的, 激烈的, 严重的, 急性的\n[医] 急性的; 尖锐的",,2,,gk cet4 cet6 ky toefl ielts gre,3249,5255,s:acutes/t:acutest,,
adage,'ædidʒ,n a condensed but memorable saying embodying some important fact of experience that is taken as true by many people,"n. 格言, 谚语",,,,toefl gre,18586,15783,s:adages,,
ADAIR,,,n. 亚岱尔（男子名）；阿戴尔（美国城市名）,,,,,27769,0,,,
ADAMS,'ædәmz,n. American Revolutionary leader and patriot; an organizer of the Boston Tea Party and signer of the Declaration of Independence (1722-1803)\nn. 6th President of the United States; son of John Adams (1767-1848)\nn. 2nd President of the United States (1735-1826),[计] 先进数据管理系统,,,,,5767,0,,,
Adana,'ædәnә,n. a city in southern Turkey on the Seyhan River,"亚达那(土耳其南部一城市, 濒Seyhan 河)",,,,,49630,0,,,
adapt,ә'dæpt,"v. make fit for, or change to suit a new purpose","vt. 使适应, 改编\nvi. 适应",,2,1,gk cet4 cet6 ky toefl ielts gre,2816,2933,d:adapted/i:adapting/p:adapted/3:adapts,,
added,'ædid,"v make an addition (to); join or combine or unite with others; increase the quality, quantity, size or scope of\nv state or say further\nv bestow a quality on\nv make an addition by combining numbers\nv determine the sum of\nv constitute an addition",a. 额外的；更多的,,1,,,4299,4550,0:add/1:pd/d:added/p:added,,
adder,'ædә,n. a person who adds numbers\nn. a machine that adds numbers\nn. small terrestrial viper common in northern Eurasia,"n. 蝰蛇, 猪鼻蛇, 加法器\n[计] 加法器",,,,,24778,28037,s:adders,,
addis,'ædis,,n. 艾缔思（姓氏）,,,,,17672,0,,,
addle,'ædl,v. mix up or confuse\nv. become rotten,"vt. 使昏乱, 使腐坏\nvi. 变质\na. 昏乱的, 腐坏的",,,,toefl gre,46635,37606,d:addled/3:addles/p:addled/i:addling,,
adele,ә'del,,n. 阿黛尔（女子名）,,,,,25166,0,,,
adept,ә'dept,s. having or showing knowledge and skill and aptitude,"a. 熟练的, 老练的, 巧妙的\nn. 能手, 内行",,1,,toefl ielts gre,13923,10221,s:adepts,,
adieu,ә'dju:,n. a farewell remark,"interj. 再见, 再会\nn. 告别, 辞别",,,,,43994,29803,,,
ADIOS,ɑ:'djәus,n a farewell remark,"[计] 模数输入输出系统, 自动诊断输入输出系统",,,,,0,29832,0:adio/1:s,,
adler,'ædlә,,n. 阿德勒（姓氏）,,,,,21704,0,,,
adlib,æd'lib,,"v. 临时穿插, 信口说出, 即兴讲演\n[计] 状态说明设计语言",,,,gre,0,0,i:adlibbing,,
adman,'ædmæn,n someone whose business is advertising,"n. 广告撰写员, 广告商",,,,,37941,36431,s:admen,,
ADMIN,,,[计] 行政管理程序,,,,,22307,29930,s:admins,,
admit,әd'mit,"v. declare to be true or admit the existence or reality or truth of\nv. allow to enter; grant entry to\nv. allow participation in or the right to be part of; permit to exercise the rights, functions, and responsibilities of\nv. afford possibility","vt. 承认, 接受, 允许进入, 容许\nvi. 开向, 容许, 承认",,4,1,gk cet4 ky toefl,887,1089,p:admitted/d:admitted/3:admits/i:admitting,,
Adnan,,,n. (Adnan)人名；(阿拉伯、土)阿德南,,,,,49890,0,,,
adobe,ә'doubi,n. the clay from which adobe bricks are made\nn. sun-dried brick; used in hot dry climates,n. 风干土坯\n[化] 风干砖; 土砖; 灰质粘土; 多孔粘土,,,,toefl gre,17875,14939,s:adobes,,
adobo,ә'dәjbәj,n. a dish of marinated vegetables and meat or fish; served with rice,"n. 阿斗波(拉美、菲律宾等地的一种菜肴, 源自西班牙)",,,,,0,27545,,,
Adolf,'ædɔif,,n. 阿道夫(亦作Adolph) (m.),,,,,16202,0,,,
adopt,ә'dɒpt,"v. choose and follow; as of theories, ideas, policies, strategies or plans\nv. take up and practice as one's own\nv. take into one's family","vt. 采用, 正式通过, 收养, 接受\n[医] 采取",,4,1,gk cet4 cet6 ky toefl ielts gre,1157,1632,d:adopted/p:adopted/i:adopting/3:adopts,,
adore,ә'dɒ:,v. love intensely,"vt. 崇拜, 爱慕, 喜爱\nvi. 崇拜, 爱慕",,2,,gk cet6 ky toefl ielts gre,8708,7705,p:adored/3:adores/d:adored/i:adoring,,
adorn,ә'dɒ:n,"v make more attractive by adding ornament, colour, etc.\nv be beautiful to look at\nv furnish with power or authority; of kings or emperors","vt. 装饰, 使生色",,1,,toefl gre,8692,8007,d:adorned/p:adorned/i:adorning/3:adorns,,
adult,'ædʌlt,n. a fully developed person from maturity onward\nn. any mature animal\ns. (of animals) fully developed,"n. 成人, 成虫\na. 成年的, 成熟的",,4,1,gk cet4 ky ielts,1236,969,s:adults,,
aegis,'i:dʒis,n kindly endorsement and guidance\nn armor plate that protects the chest; the front part of a cuirass,"n. 羊皮盾, 保护, 庇护, 赞助, 支持\n[法] 庇护, 保护",,,,gre,19062,18213,,,
aerie,'єәri,n. the lofty nest of a bird of prey (such as a hawk or eagle)\nn. any habitation at a high altitude,"n. 猛禽的巢, 高处的房子, 高处的城堡",,,,,0,28656,,,
Aesop,'i:sɒp,n. Greek author of fables (circa 620-560 BC),n. 伊索,,,,,42117,0,,,
affix,ә'fiks,n. a linguistic element added to a word to produce an inflected or derived form\nv. attach to\nv. attach or become attached to a stem word,"vt. 使附于, 署名, 粘贴, 盖印于\nn. 附加物, 词缀",,,,ielts gre,21256,13876,d:affixed/s:affixes/p:affixed/i:affixing/3:affixes,,
afire,ә'faiә,s lighted up by or as by fire or flame,"a. 燃烧的, 炽烈的\nadv. 燃烧着",,,,,39438,19880,,,
afoot,ә'fut,s. traveling by foot\ns. currently in progress\nr. on foot; walking,"a. 徒步的, 在进行中的, 活动中的\nadv. 徒步, 在进行中",,1,,,19318,17330,,,
afore,ә'fɒ:,"adv. Before.\nadv. In the fore part of a vessel.\nprep. Before (in all its senses).\nprep. Before; in front of; farther forward than; as, afore the\n   windlass.",adv. 在前\nprep. 在...前,,,,,27038,34172,,,
after,'ɑ:ftә,s. located farther aft\nr. behind or in the rear,"prep. 在...之后, 由于\nconj. 在...之后\nadv. 后来",,5,1,zk gk,96,120,,,
again,ә'gein,r. anew,"adv. 再一次, 又, 到原处",,5,1,zk gk,156,184,,,
agape,ә'geip,n. (Christian theology) the love of God or Christ for mankind\nn. selfless love of one person for another without sexual implications (especially love that is spiritual in nature)\nn. a religious meal shared as a sign of love and fellowship,"a. 张口发呆的, 目瞪口呆的\nadv. 张口发呆地, 目瞪口呆地",,,,gre,34727,24011,,,
agate,'ægәt,n. an impure form of quartz consisting of banded chalcedony; used as a gemstone and for making mortars and pestles,"n. 玛瑙, 五又二分之一点铅字\n[化] 玛瑙149",,,,,40533,29053,s:agates,,
agave,ә'geivi,n. tropical American plants with basal rosettes of fibrous sword-shaped leaves and flowers in tall spikes; some cultivated for ornament or for fiber,n. 龙舌兰\n[机] 龙舌兰属,,,,,0,25256,s:agaves,,
agent,'eidʒәnt,n. an active and efficient cause; capable of producing a certain effect\nn. a representative who acts on behalf of other persons or organizations\nn. a substance that exerts some force or effect\nn. a businessman who buys or sells for another in exchange for a commission,"n. 代理商, 政府代表, 动原, 媒介\n[计] 代理程序",,4,1,gk cet4 ky toefl,1214,1020,s:agents,,
aggie,'æɡi,,n. 农业学校；农科大学生,,,,,13603,0,,,
aggro,'æ^rәu,n. (informal British usage) aggravation or aggression,n. 暴力行为,,,,,24168,43999,s:aggros,,
agile,'ædʒail,s. moving quickly and lightly\ns. mentally quick,"a. 敏捷的, 灵活的, 机敏的",,1,,toefl gre,14554,14174,,,
aging,'eidʒiŋ,n. the organic process of growing older and showing the effects of increasing age\ns. growing old,"n. 老化, 变陈\n[计] 老化, 陈化",,,,,23291,5306,i:aging/0:aging/1:i,,
aglow,ә'glәu,s. softly bright or radiant,"a. 发光的, 通红的\nadv. 发光地",,,,toefl,34061,23037,,,
agnes,'æ^nis,,n. 艾格尼丝（女子名）,,,,,6292,0,,,
Agnew,,,阿格纽,,,,,17428,0,,,
agony,'ægәni,n. intense feelings of suffering; acute mental or physical pain\nn. a state of acute pain,"n. 极大的痛苦, 挣扎\n[医] 濒死苦闷; 剧痛",,2,,cet4 cet6 ky ielts gre,5575,7577,s:agonies,,
agora,'ægәrә,n. 100 agorot equal 1 shekel in Israel\nn. the marketplace in ancient Greece\nn. a place of assembly for the people in ancient Greece,"n. 集会, 市场",,,,,48144,34249,,,
agree,ә'gri:,"v. be in accord; be in agreement\nv. consent or assent to a condition, or agree to do something\nv. show grammatical agreement\nv. be agreeable or suitable","vi. 同意, 赞成, 应允, 适合\nvt. 承认, 认定, 同意",,5,1,zk gk,401,514,d:agreed/p:agreed/3:agrees/i:agreeing,,
ahead,ә'hed,s. having the leading position or higher score in a contest\nr. at or in the front\nr. toward the future; forward in time\nr. in a forward direction,"a. 领先的, 预先的, 向前的\nadv. 领先, 预先, 向前, 胜于, 在前面, 在将来",,4,1,gk,1504,1025,,,
ahhhh,,,啊（非正式）,,,,,0,32467,,,
ahmad,,,n. 阿哈默德（穆罕默德在《古兰经》中的名称）,,,,,17819,0,,,
ahmed,,,n. 艾哈迈德（男子名）,,,,,9345,0,,,
Ahmet,,,n. (Ahmet)人名；(土、塞、阿尔巴、罗、阿拉伯)艾哈迈德,,,,,47401,0,,,
ahold,ә'hәjld,"adv. Near the wind; as, to lay a ship ahold.","n. 抓, 握\nadv. 迎风航驶",,,,,0,19156,,,
Aidan,,,艾丹,,,,,25348,0,,,
aided,'eidid,v give help or assistance; be of service\nv improve the condition of\na having help; often used as a combining form,a. 辅助的；半自动的,,,,,41432,44349,0:aid/1:dp/p:aided/d:aided,,
aider,,"n. One who, or that which, aids.","[法] 助手, 帮手, 辅助人",,,,,37484,0,s:aiders,,
aiken,'eikәn,n. United States writer (1889-1973),n. 艾肯（美国诗人、文学批评家、小说家）；艾肯（南卡罗莱纳大学University of South Carolina 分校校区）,,,,,41036,0,,,
Ailsa,,,n. 艾尔莎（女子名）,,,,,45952,0,,,
aioli,ai'әjli,n. garlic mayonnaise,n. 蒜泥蛋黄酱(一种用蒜泥、蛋黄、橄榄油和柠檬汁配制的调味汁),,,,,0,27122,s:aioli/0:aioli/1:s,,
aired,,s. open to or abounding in fresh air,通风\n夸耀\n晾干（air的过去式和过去分词）,,,,,0,42588,0:air/1:dp,,
aires,,"n a river in northern England that flows southeast through West Yorkshire\nv expose to fresh air\nv be broadcast\nv broadcast over the airwaves, as in radio or television\nv make public\nv expose to warm or heated air, so as to dry\nv expose to cool or cold air so as to cool or freshen",n. 白羊座,,,,,16175,0,,,
Airey,,,艾雷（人名）,,,,,36154,0,,,
aisle,ail,n. a long narrow passage (as in a cave or woods)\nn. passageway between seating areas as in an auditorium or passenger vehicle or between areas of shelves of goods as in stores\nn. part of a church divided laterally from the nave proper by rows of pillars or columns,"n. 走廊, 侧廊, 过道\n[机] 走道",,1,,ky ielts,7161,4484,s:aisles,,
aitch,eitʃ,n. The letter h or H.,"n. H, h的字母, h音\na. H形的",,,,,39201,0,s:aitches/d:aitched,,
Akbar,'ækbɑ:,,"n. 阿克巴（印度莫卧儿帝国皇帝, 等于Akbar the Great）",,,,,27636,0,,,
Akers,,,n. (Akers)人名；(英)埃克斯,,,,,30281,0,,,
akira,,,n. 阿基拉（动画片）,,,,,46461,0,,,
Akram,,,n. 阿克拉姆（人名）,,,,,28436,0,,,
Alain,,,n. 阿兰（人名）\nn. (Alain)人名；(西)阿拉因；(英、法、布基、黎)阿兰,,,,,7468,0,,,
alamo,'ælәmәu,n. a siege and massacre at a mission in San Antonio in 1836; Mexican forces under Santa Anna besieged and massacred American rebels who were fighting to make Texas independent of Mexico,n. [植]白杨,,,,,43796,15914,,,
alarm,ә'lɑ:m,n. fear resulting from the awareness of danger\nn. a device that signals the occurrence of some undesirable event\nn. an automatic signal (usually a sound) warning of danger\nv. warn or arouse to a sense of danger or call to a state of preparedness,"n. 惊恐, 警报, 警钟\nvt. 使惊恐, 警告\n[计] 报警信号",,3,1,gk cet4 ky toefl ielts,3004,3693,s:alarms/d:alarmed/p:alarmed/i:alarming/3:alarms,,
Alban,"'ɔ:lbәn,'æl-",n. A white crystalline resinous substance extracted from\n   gutta-percha by the action of alcohol or ether.,"n. 奥尔本(亦作Alben, Albin)(m.)",,,,,25659,0,,,
Albie,,,艾尔比（人名）,,,,,31387,0,,,
album,'ælbәm,n. one or more recordings issued together; originally released on 12-inch phonograph records (usually with attractive record covers) and later on cassette audiotape and compact disc\nn. a book of blank pages with pockets or envelopes; for organizing photographs or stamp collections etc,"n. 粘贴簿, 唱片套\n[医] 白色物",,4,,gk cet6 ky ielts,2991,2215,s:albums,,
alder,'ɒ:ldә,n. wood of any of various alder trees; resistant to underwater rot; used for bridges etc\nn. north temperate shrubs or trees having toothed leaves and conelike fruit; bark is used in tanning and dyeing and the wood is rot-resistant,n. 桤木\n[机] 赤杨木,,,,toefl,16030,18527,s:alders,,
Aldus,,,奥尔德斯（男子名）,,,,,30402,0,,,
aleph,'ɑ:lif,n. the 1st letter of the Hebrew alphabet,n. 希伯来文的第一个字母,,,,,0,27403,,,
alert,ә'lә:t,n. condition of heightened watchfulness or preparation for action\nn. a warning serves to make you more alert to danger\na. engaged in or accustomed to close observation\ns. quick and energetic,"a. 警觉的, 灵敏的, 留心的\nn. 警报\nvt. 使警觉, 通知, 使意识到",,3,,cet4 cet6 ky toefl gre,4966,5318,d:alerted/p:alerted/i:alerting/3:alerts/s:alerts,,
Alesi,,,n. (Alesi)人名；(法)阿莱西,,,,,47732,0,s:alesi/0:alesi/1:s,,
Alfie,'ælfi,,n. 阿尔菲(Alfred的昵称)(m.),,,,,26417,0,,,
algae,'ælgi:,n primitive chlorophyll-containing mainly aquatic eukaryotic organisms lacking true stems and roots and leaves,"pl. 藻类, 海藻\n[化] 藻类",,1,,toefl,0,9463,0:alga/1:s/s:algaes,,
algal,'æl^әl,a. of or relating to alga,[医] 藻的,,,,,26953,20167,,,
alias,'eiliæs,n. a name that has been assumed temporarily\nr. as known or named at another time or place,"n. 别名, 化名\nadv. 以化名为人所知\n[计] 别名; 替换入口",,1,,gre,19639,21758,,,
alibi,'ælibai,n. (law) a defense by an accused person purporting to show that he or she could not have committed the crime in question\nv. exonerate by means of an alibi,"n. 不在犯罪现场, 托辞\nv. 为...辩解",,1,,gre,16263,13258,s:alibis/i:alibiing/p:alibied/3:alibis/d:alibied,,
ALICE,'ælis,,[计] 应用语言接口转换与扩充,,,,,3048,0,,,
Alick,,,亚历克（男子名）,,,,,47576,0,,,
Alida,,,n. (Alida)人名；(俄、瑞典)阿莉达,,,,,18351,0,,,
alien,'eiljәn,v. transfer property or ownership\ns. not contained in or deriving from the essential nature of something\ns. being or from or characteristic of another place or part of the world,"n. 外国人, 外侨\na. 外国的, 相异的",,2,,cet6 ky toefl ielts,5998,3977,s:aliens/i:aliening/p:aliened/3:aliens/d:aliened,,
align,ә'lain,v. place in a line or arrange so as to be parallel or straight\nv. be or come into adjustment with\nv. align oneself with a group or a way of thinking\nv. bring (components or parts) into proper or desirable coordination correlation,"vi. 排列, 排成一行, 结盟\nvt. 使结盟, 使成一行, 校正",,2,,gre,7857,5939,d:aligned/p:aligned/i:aligning/3:aligns,,
alike,ә'laik,a. having the same or similar characteristics\nr. equally\nr. in a like manner,"a. 相似的, 同样的\nadv. 一样, 以同样的方式",,2,,gk cet4 cet6 ky toefl,4989,4389,,,
Alina,ailina,,n. 爱丽娜（女子名）,,,,,32146,0,,,
aline,ә'lain,v place in a line or arrange so as to be parallel or straight,"v. 排成直线, 排列",,,,,30992,0,i:alining/p:alined/3:alines/d:alined,,
alive,ә'laiv,a. possessing life\ns. (often followed by `with') full of life and spirit\ns. (followed by `to' or `of') aware of\ns. capable of erupting,"a. 活着的, 活泼的, 敏感的, 热闹的",,3,1,zk gk cet4 cet6 ky,2080,1532,,,
alkyd,'ælkid,n. a durable synthetic resin widely used in adhesives and paints,n. 醇酸树脂,,,,,0,29879,s:alkyds,,
alkyl,'ælkil,n. any of a series of univalent groups of the general formula CnH2n+1 derived from aliphatic hydrocarbons,"n. 烷基, 烃基\na. 烷基的, 烃基的",,,,,47977,0,s:alkyls,,
Allah,'ælә,n. Muslim name for the one and only God,n. 安拉,,1,,,22923,0,,,
allan,'ælәn,,"n. 艾伦（男子名, 等于Alan）",,,,,5840,0,,,
allay,ә'lei,v lessen the intensity of or calm\nv satisfy (thirst),"vt. 使平静, 使缓和",,1,,gre,14151,17138,d:allayed/p:allayed/i:allaying/3:allays,,
allen,"'ælin, 'ælәn","n. United States comedienne remembered as the confused but imperturbable partner of her husband, George Burns (1906-1964)\nn. United States filmmaker and comic actor (1935-)\nn. a soldier of the American Revolution whose troops helped capture Fort Ticonderoga from the British (1738-1789)",n. 艾伦（男子名）,,,,,3889,40152,,,
alley,'æli,n. a narrow street with walls on both sides,"n. 小路, 巷",,1,,gk ielts,6528,4340,s:alleys,,
Alloa,,,阿洛厄,,,,,39156,0,,,
allot,ә'lɒt,"v give out\nv allow to have\nv administer or bestow, as in small portions","vt. 分配, 分摊指定\n[经] (按股或按规定)分配, 配(拨)给, 规(派)定",,1,,toefl ielts,11461,13192,d:allotted/i:allotting/3:allots/p:allotted,,
allow,ә'lau,v. let have\nv. give or assign a resource to a particular person or cause\nv. allow or plan for a certain possibility; concede the truth or validity of something\nv. grant as a discount or in exchange,"vt. 允许, 同意给予, 承认\nvi. 容许, 猜想\n[计] 允许命令",,5,1,zk gk cet4 ky,257,339,d:allowed/i:allowing/3:allows/p:allowed,,
alloy,'ælɒi. ә'lɒi,n. a mixture containing two or more metallic elements or metallic and nonmetallic elements usually fused together or dissolving into each other when molten\nv. make an alloy of,"n. 合金\nvt. 将...铸成合金, 减低成色\nvi. 合铸",,1,,cet4 cet6 ky toefl ielts,10493,11808,s:alloys/i:alloying/d:alloyed/p:alloyed/3:alloys,,
aloft,ә'lɒft,r. at or on or to the masthead or upper rigging of a ship\nr. upward\nr. at or to great height; high up in or into the air\nr. in the higher atmosphere above the earth,"adv. 在高处, 在上",,1,,toefl gre,14657,12541,,,
aloha,ә'lәuhә,n. an acknowledgment that can be used to say hello or goodbye (aloha is Hawaiian and ciao is Italian),"interj. 喂, 再见",,,,,0,26378,,,
Alois,,,n. (Alois)人名；(德、英、捷、罗、西)阿洛伊斯；(法)阿卢瓦,,,,,45028,0,,,
alone,ә'lәun,s. isolated from others\ns. lacking companions or companionship\ns. exclusive of anyone or anything else\ns. radically distinctive and without equal,"a. 孤独的, 单独的, 独自的\nadv. 独自地",,4,1,zk gk cet4 ky toefl ielts,1297,1097,,,
along,ә'lɒŋ,r. with a forward motion\nr. in accompaniment or as a companion\nr. to a more advanced state\nr. in addition (usually followed by `with'),"adv. 平行地, 向前\nprep. 沿着",,5,1,zk gk,823,447,,,
aloof,ә'lu:f,s. remote in manner\nr. in an aloof manner,"a. 远离的, 冷淡的\nadv. 远离, 冷漠超然地",,1,,toefl gre,13857,14411,,,
alors,æ'lɔ:,,<法>int.那末,,,,,43605,0,,,
aloud,ә'laud,r. using the voice; not silently,"adv. 出声地, 大声地",,1,1,zk gk cet4 ky,5849,5694,,,
alpha,'ælfә,n. the 1st letter of the Greek alphabet\nn. the beginning of a series or sequence\ns. first in order of importance,"n. 希腊字母表的第一个字母, 最初, 开端\n[医] α(希腊文的第一个字母), 甲种",,,,,5488,6714,s:alphas,,
Altai,æl'teiai,,"n. 阿尔泰语(苏联境内一语言),阿尔泰山",,,,,47951,0,,,
altar,'ɒ:ltә,n. the table in Christian churches where communion is given\nn. a raised structure on which gifts or sacrifices to a god are made,"n. 圣坛, 祭坛",,1,,,5800,5661,s:altars,,
alter,'ɒ:ltә,v. make an alteration to\nv. remove the ovaries of,v. 改变,,3,1,cet4 cet6 ky toefl ielts gre,2121,2889,d:altered/i:altering/3:alters/p:altered,,
Alton,'ɔ:ltәn,,"奥尔顿(①姓氏, 男子名 ②美国一城市)",,,,,8324,0,,,
Alves,,,n. 阿尔维斯（男子名）,,,,,47252,0,,,
Alvey,,,阿尔维（人名）,,,,,30943,0,,,
alvin,'ælvin,,[机] 阿尔文,,,,,24898,0,,,
Alwyn,'ælwin,,n. 阿尔文（英国的作曲家）,,,,,27188,0,,,
amass,ә'mæs,v collect or gather\nv get or gather together,"vt. 积聚, 堆积",,1,,toefl gre,13689,9638,d:amassed/p:amassed/i:amassing/3:amasses,,
Amato,,,n. (Amato)人名；(法、西、意、葡)阿马托；(日)天户(姓),,,,,46062,0,,,
amaze,ә'meiz,v. affect with wonder,vt. 使吃惊,,2,1,gk cet4 cet6 ky toefl ielts,11151,8607,p:amazed/3:amazes/i:amazing/d:amazed/s:amazes,,
