word,phonetic,definition,translation,pos,collins,oxford,tag,bnc,frq,exchange,detail,audio
scott,skɔt,n. award-winning United States film actor (1928-1999)\nn. English explorer who reached the South Pole just a month after Amundsen; he and his party died on the return journey (1868-1912)\nn. United States general who was a hero of the War of 1812 and who defeated Santa Anna in the Mexican War (1786-1866),n. 斯科特（男子名）,,,,,2616,0,,,
scour,'skauә,n. a place that is scoured (especially by running water)\nv. examine minutely\nv. rub hard or scrub,"vt. 擦亮, 洗涤, 清洗, 冲刷成, 急速穿过\nvi. 擦, 洗, 冲刷, 腹泻, 急速穿行\nn. 擦, 洗, 腹泻, 洗涤剂",,1,,toefl gre,11212,9501,i:scouring/p:scoured/d:scoured/3:scours,,
scout,skaut,"n. a Boy Scout or Girl Scout\nn. someone employed to discover and recruit talented persons (especially in the worlds of entertainment or sports)\nn. someone who can find paths through unexplored territory\nv. explore, often with the goal of finding something or somebody","n. 守候, 侦察, 搜索, 侦察员, 侦察机\nvi. 守候, 侦察, 巡视, 嘲笑\nvt. 侦察, 跟踪, 发现, 监视, 嘲弄",,1,,cet4 cet6 ky toefl ielts,6892,7109,s:scouts/i:scouting/p:scouted/3:scouts/d:scouted,,
scowl,skaul,v. frown with displeasure,"n. 愁容, 阴沉脸色\nvi. 皱眉, 绷着脸\nvt. 怒视",,1,,gre,13071,11097,p:scowled/i:scowling/s:scowls/3:scowls/d:scowled,,
scrag,skræg,n. lean end of the neck\nn. the lean end of a neck of veal,"n. 骨瘦如柴的人, 生长受阻的植物, 颈肉\nvt. 绞死, 缠住...的颈项",,,,,46222,0,d:scragged/i:scragging/3:scrags/p:scragged,,
scram,skræm,v. leave immediately; used usually in the imperative form,n. 紧急刹车\nvi. 快速离去,,,,,0,36701,i:scramming/p:scrammed/3:scrams/d:scrammed,,
scrap,skræp,n. a small piece of something that is left over after the rest has been used\nv. make into scrap or refuse,"n. 碎片, 残余物, 些微, 片断, 铁屑, 吵架\nvt. 扔弃, 敲碎, 拆毁\nvi. 互相殴打\na. 零碎拼凑成的, 废弃的",,2,,cet6 ky toefl ielts gre,5535,5594,s:scraps/d:scrapped/i:scrapping/p:scrapped/3:scraps,,
scree,skri:,n a sloping mass of loose rocks at the base of a cliff,"n. 山麓碎石, 岩屑堆",,,,,21399,24595,s:screes,,
screw,skru:,n. a simple machine of the inclined-plane type consisting of a spirally threaded cylindrical rod that engages with a similarly threaded hole\nn. a propeller with several angled blades that rotates to push against water or air\nn. a fastener with a tapered threaded shank and a slotted head\nv. turn like a screw,"n. 螺旋, 螺杆, 螺钉, 螺旋桨, 吝啬鬼\nvt. 调节, 扭紧, 旋, 拧, 加强, 压榨, 勒索\nvi. 转动, 旋, 拧",,2,1,cet4 cet6 ky toefl ielts gre,5393,4750,s:screws/p:screwed/i:screwing/d:screwed/3:screws,,
scrim,skrim,n. a firm open-weave fabric used for a curtain in the theater,n. 平纹棉麻织物,,,,,0,27401,,,
scrip,skrip,n. a certificate whose value is recognized by the payer and payee; scrip is not currency but may be convertible into currency,"n. 便条, 纸条, 纸片\n[经] 股票临时收据, 临时凭单, 代价券",,,,,28519,32351,s:scrips,,
scrod,skrɒd,n. young Atlantic cod or haddock especially one split and boned for cooking,n. 幼鳕,,,,,0,46035,,,
scrol,,,"abbr. semicustom chip row organized layout 半定制芯片行编排电路设计, 半定制芯片行结构版图",,,,,29050,0,d:scrolled/i:scrolling/p:scrolled,,
scrub,skrʌb,n. dense vegetation consisting of stunted trees or bushes\nn. the act of cleaning a surface by rubbing it with a brush and soap and water\nv. clean with hard rubbing\nv. wash thoroughly,"n. 用力擦洗, 矮树, 矮人, 渺小之物\nvt. 用力擦洗, 擦掉, 摩擦\nvi. 擦洗干净, 进行手臂消毒\na. 次等的, 矮小的, 非正规球队的, 临时凑合的",,2,,cet6 toefl gre,7929,7546,d:scrubbed/i:scrubbing/p:scrubbed/3:scrubs/s:scrubs,,
scrum,skrʌm,n. (rugby) the method of beginning play in which the forwards of each team crouch side by side with locked arms; play starts when the ball is thrown in between them and the two sides compete for possession,"n. (橄榄球中)扭夺, 并列争球",,1,,,10789,29730,s:scrums/p:scrummed,,
scuba,'skju:bә,n a device (trade name Aqua-Lung) that lets divers breathe under water; scuba is an acronym for self-contained underwater breathing apparatus,n. 自携式水中呼吸器,,,,toefl,24752,13275,,,
scuff,skʌf,n. the act of scuffing (scraping or dragging the feet)\nv. walk without lifting the feet\nv. get or become scuffed,"vi. 拖着脚走, 磨损\nvt. 拳打, 攻击, 用足尖触, 使磨损\nn. 拖着脚走, 磨损, 家用平底拖鞋",,,,toefl gre,23712,18214,p:scuffed/i:scuffing/d:scuffed/s:scuffs/3:scuffs,,
scull,skʌl,n. a long oar that is mounted at the stern of a boat and moved left and right to propel the boat forward\nn. each of a pair of short oars that are used by a single oarsman\nn. a racing shell that is propelled by sculls,"n. 短桨, 尾橹\nvt. 摇桨, 划\nvi. 划船",,,,,33786,23466,3:sculls/i:sculling/p:sculled/d:sculled,,
SEALE,,,n. 西鲁结构,,,,,43713,0,,,
seamy,'si:mi,s. showing a seam\ns. morally degraded,"a. 露出线缝的, 丑恶的",,,,gre,33696,26775,r:seamier,,
sears,,v make very hot and dry\nv become superficially burned\nv burn slightly and superficially so as to affect color\nv cause to wither or parch from exposure to heat,v. 使干枯；灼伤（sear的单三形式）,,,,,22930,0,0:sear/1:3s,,
seats,,n an area that includes places where several people can sit\nn a space reserved for sitting (as in a theater or on a train or airplane)\nn the fleshy part of the human body that you sit on\nn furniture that is designed for sitting on\nn any support where you can sit (especially the part of a chair or bench etc. on which you sit)\nn a center of authority (as a city from which authority is exercised)\nn the location (metaphorically speaking) where something is based\nn the legal right to sit as a member in a legislative or similar body\nn a part of a machine that supports or guides another part\nn the cloth covering for the buttocks\nv show to a seat; assign a seat for\nv be able to seat\nv place ceremoniously or formally in an office or position\nv put a seat on a chair\nv provide with seats\nv place or attach firmly in or on a base\nv place in or on a seat,"n. 座椅, 座位（seat的复数形式）",,,,ielts,0,0,1:s3/0:seat,,
sebum,'si:bәm,n. the oily secretion of the sebaceous glands; with perspiration it moistens and protects the skin,"n. 皮脂\n[医] 皮脂; 羊脂, 牛羊脂",,,,,0,42058,,,
sedan,si'dæn,n. a car that is closed and that has front and rear seats and two or four doors\nn. a closed litter for one passenger,"n. 轿车, 轿子",,1,,,34903,6967,s:sedans,,
sedge,sedʒ,"n. grasslike or rushlike plant growing in wet places having solid stems, narrow grasslike leaves and spikelets of inconspicuous flowers","n. 莎草, 蓑衣草",,1,,,35269,23943,s:sedges/3:sedges,,
sedum,'si:dәm,n. any of various plants of the genus Sedum,n. 景天\n[医] 景天,,,,,0,30839,s:sedums,,
seedy,'si:di,a. full of seeds,"a. 多种子的, 结籽的, 破烂的, 肮脏的",,1,,,18461,15847,r:seedier/t:seediest,,
seely,'si:li,a. See Silly.,"可怜的, 令人怜悯的",,,,,47499,0,,,
Segal,,n. United States sculptor (born in 1924),n. 西格尔（人名）,,,,,27202,0,,,
segue,"'se^wei, 'sei^wei",n. the act of changing smoothly from one state or situation to another\nv. proceed without interruption; in music or talk,n. [用作指示语][音]继续,,,,,0,21014,p:segued/d:segued/i:segueing/s:segues/3:segues/f:segues,,
seige,,,n. (Seige)人名；(日)清家(姓),,,,,42125,0,,,
seiko,,,n. 日本精工株式会社（打印机生产商）,,,,,44069,0,,,
seine,sein,"n. a French river that flows through the heart of Paris and then northward into the English Channel\nn. a large fishnet that hangs vertically, with floats at the top and weights at the bottom\nv. fish with a seine; catch fish with a seine","n. 曳网, 拖地大网\nvt. 用曳网围捕\nvi. 用曳网捕鱼",,,,gre,19738,36495,s:seines/i:seining/p:seined/3:seines/d:seined,,
seize,si:z,v. take hold of; grab\nv. take or capture by force\nv. hook by a pull on the line\nv. affect,"vt. 抓住, 逮捕, 俘获, 没收, 扣押, 掌握\nvi. 突然抓住, 利用",,3,,gk cet4 cet6 ky toefl,2974,3230,d:seized/p:seized/i:seizing/3:seizes,,
Selby,,,n. (Selby)人名；(英)塞尔比,,,,,10885,0,,,
Seles,,n. United States tennis player (born in Yugoslavia in 1973),n. (Seles)人名；(芬、瑞典)塞勒斯,,,,,29410,0,,,
Selim,,,塞利姆（人名）,,,,,45932,0,,,
Selly,,,n. (Selly)人名；(俄)谢利；(英)塞利,,,,,47544,0,,,
selva,'selvә,n a rain forest in a tropical area,n. (尤指南美洲亚马孙河沿岸的)热带雨林,,,,,0,40117,,,
semen,'si:mәn,n. the thick white fluid containing spermatozoa that is ejaculated by the male genital tract,"n. 精液, 精子\n[医] 种子; 精液",,1,,,16598,14940,,,
senna,'senә,n. any of various plants of the genus Senna having pinnately compound leaves and showy usually yellow flowers; many are used medicinally,"n. 山扁豆, 番泻叶, 轻泻剂\n[化] 番泻叶",,,,,13492,0,,,
Senor,se'njɔː,n. a Spanish title or form of address for a man; similar to the English `Mr' or `sir',n. 先生；绅士,,,,,34276,0,s:senors,,
sense,sens,n. a general conscious awareness\nn. the meaning of a word or expression; the way in which a word or expression or situation can be interpreted\nn. the faculty through which the external world is apprehended\nn. a natural appreciation or ability,"n. 感应, 感觉, 感官, 意识, 观念, 情理, 知觉, 理智\nvt. 感觉, 觉察, 检测\n[计] 阅读; 检测",,5,1,zk gk cet4 cet6 ky ielts,417,407,s:senses/p:sensed/i:sensing/d:sensed/3:senses,,
Seoul,sәul,n. the capital of South Korea and the largest city of Asia; located in northwestern South Korea,n. 汉城,,,,,13275,0,,,
sepal,'si:pl,n. one of the green parts that form the calyx of a flower,n. 萼片\n[医] 萼片,,,,,0,39317,s:sepals,,
sepia,'si:pjә,n. rich brown pigment prepared from the ink of cuttlefishes\nn. type genus of the Sepiidae,"n. 乌贼, 乌贼墨颜料, 深褐色, 乌贼汁\na. 乌贼墨色的, 使用乌贼墨颜料的",,,,,22152,23610,s:sepias,,
sepoy,'si:pɒi,"n. A native of India employed as a soldier in the service of a\n   European power, esp. of Great Britain; an Oriental soldier disciplined\n   in the European manner.",n. 印度兵,,,,,31973,44410,s:sepoys,,
septa,'septә,n (anatomy) a dividing partition between two tissues or cavities\nn a partition or wall especially in an ovary,"中隔, 隔膜, 隔, 间隔\n[医] 中隔, 间隔, 隔",,,,,0,46536,,,
Serbs,,n a member of a Slavic people who settled in Serbia and neighboring areas in the 6th and 7th centuries,n. 塞尔维亚人（Serb的复数形式）,,,,,7485,0,0:serb/1:s,,
serge,sә:dʒ,n. a twilled woolen fabric,n. 哔叽,,,,,24905,30485,s:serges,,
serie,,n. Series.,n. 批量；系列,,,,,49064,0,,,
serif,'serif,n. a short line at the end of the main strokes of a character,"n. 西文字体中的短细线, 衬线\n[计] 衬线",,,,,48100,32014,s:serifs,,
SERPS,,,国家收入关联养老金计划,,,,,17834,0,0:serp/1:s,,
serra,'serә,n. Spanish missionary who founded Franciscan missions in California (1713-1784),[医] 锯齿状器官,,,,,30305,0,,,
serum,'siәrәm,"n. an amber, watery fluid, rich in proteins, that separates out when blood coagulates","n. 浆液, 血清, 乳清\n[医] 血清; 浆液",,1,,,4917,9974,s:serums,,
serve,sә:v,"n. (sports) a stroke that puts the ball in play\nv. serve a purpose, role, or function\nv. do duty or hold offices; serve in a specific function\nv. contribute or conduce to","vt. 可作...用, 服务, 经历, 招待, 供应, 送交, 对待\nvi. 服务, 服役, 侍应, 适合, 有用, 开球\nn. 发球, 轮到发球",,4,1,zk gk,625,401,d:served/i:serving/p:served/3:serves/s:serves,,
servo,'sә:vәu,n. control system that converts a small mechanical motion into one requiring much greater power; may include a negative feedback system,"n. 伺服, 伺服系统\n[计] 伺服装置",,,,,29027,21000,s:servos,,
sethe,,,n. (Sethe)人名；(德)泽特,,,,,19811,0,i:seething,,
seton,'si:tn,n. United States religious leader who was the first person born in the United States to be canonized (1774-1821),"n. 泄液线\n[医] 挂线, 串线; 挂线管道",,,,,30383,0,s:setons,,
setup,'setʌp,n. the way something is organized or arranged,"n. 装备, 组织, 计划, 机构, 调整, 设置\n[计] 设置",,,,,17383,5868,s:setups,,
seven,'sevn,n. the cardinal number that is the sum of six and one\ns. being one more than six,"num. 七, 七个",,5,,zk gk,575,734,,,
sever,'sevә,v. set or keep apart,"vt. 切断, 脱离, 分开, 使分离, 断绝, 中断\nvi. 断, 裂开",,1,,toefl gre,8492,8957,d:severed/i:severing/p:severed/3:severs,,
sewer,'su:ә,n. a waste pipe that carries away sewage or surface water\nn. someone who sews,"n. 下水道, 阴沟, 裁缝师\nvt. 用下水道排, 铺设下水道于",,1,,toefl ielts gre,9600,7453,s:sewers/d:sewered,,
shack,ʃæk,"n small crude shelter used as a dwelling\nv make one's home in a particular place or community\nv move, proceed, or walk draggingly or slowly","n. 陋屋, 棚屋\nvi. 居住, 暂住",,1,,gre,14868,7290,s:shacks/d:shacked/p:shacked/i:shacking/3:shacks/f:shacks,,
shade,ʃeid,n. relative darkness caused by light rays being intercepted by an opaque body\nn. a quality of a given color that differs slightly from another color\nn. protective covering that protects something from direct sunlight\nn. a position of relative inferiority,"n. 荫, 阴暗, 遮光物, 灯罩, 帘, 浓淡, 微量, 底纹\nvi. 渐变\nvt. 使阴暗, 使渐变, 遮蔽, 微减\n[计] 底纹",,3,1,gk cet4 cet6 ky toefl,3205,2984,s:shades/i:shading/d:shaded/p:shaded/3:shades,,
shady,'ʃeidi,s. filled with shade,"a. 荫凉的, 成荫的, 阴暗的, 隐蔽的\n[法] 成问题的, 令人怀疑的",,1,,cet4 cet6 ky,11536,9404,r:shadier/t:shadiest,,
shaft,ʃæft,n. a line that forms the length of an arrow pointer\nn. a long rod or pole (especially the handle of an implement or the body of a weapon like a spear or arrow)\nn. a vertical passageway through a building (as for an elevator)\nn. (architecture) upright consisting of the vertical part of a column,"n. 轴, 箭杆, 矛, 矿井\nvt. 装杆于, 利用",,2,,cet6 ky toefl ielts,4733,5366,s:shafts/i:shafting/p:shafted/d:shafted/3:shafts,,
shake,ʃeik,v. move or cause to move back and forth\nv. move with or as if with a tremor\nv. undermine or cause to waver\nv. get rid of,"n. 摇动, 震动\nvt. 摇动, 动摇, 使震动, 挥舞\nvi. 震动, 发抖, 动摇",,4,1,zk gk cet4 cet6 ky toefl,1076,942,p:shook/i:shaking/d:shaken/3:shakes/s:shakes,,
shaky,'ʃeiki,s. vibrating slightly and irregularly; as e.g. with fear or cold or like the leaves of an aspen in a breeze,"a. 震动的, 摇晃的, 动摇的",,1,,cet6,8423,7947,r:shakier/t:shakiest,,
shale,ʃeil,n. a sedimentary rock formed by the deposition of successive layers of clay,n. 页岩,,1,,toefl gre,12996,14985,s:shales,,
shall,ʃæl,"v. i. & auxiliary. To owe; to be under obligation for.\nv. i. & auxiliary. To be obliged; must.\nv. i. & auxiliary. As an auxiliary, shall indicates a duty or\n   necessity whose obligation is derived from the person speaking; as, you\n   shall go; he shall go; that is, I order or promise your going. It thus\n   ordinarily expresses, in the second and third persons, a command, a\n   threat, or a promise. If the auxillary be emphasized, the command is\n   made more imperative, the promise or that more positive and sure. It is\n   also employed in the language of prophecy; as, ""the day shall come when\n   . . . , "" since a promise or threat and an authoritative prophecy\n   nearly coincide in significance. In shall with the first person, the\n   necessity of the action is sometimes implied as residing elsewhere than\n   in the speaker; as, I shall suffer; we shall see; and there is always a\n   less distinct and positive assertion of his volition than is indicated\n   by will. ""I shall go"" implies nearly a simple futurity; more exactly, a\n   foretelling or an expectation of my going, in which, naturally enough,\n   a certain degree of plan or intention may be included; emphasize the\n   shall, and the event is described as certain to occur, and the\n   expression approximates in meaning to our emphatic ""I will go."" In a\n   question, the relation of speaker and source of obligation is of course\n   transferred to the person addressed; as, ""Shall you go?"" (answer, ""I\n   shall go""); ""Shall he go?"" i. e., ""Do you require or promise his\n   going?"" (answer, ""He shall go"".) The same relation is transferred to\n   either second or third person in such phrases as ""You say, or think,\n   you shall go;"" ""He says, or thinks, he shall go."" After a conditional\n   conjunction (as if, whether) shall is used in all persons to express\n   futurity simply; as, if I, you, or he shall say they are right. Should\n   is everywhere used in the same connection and the same senses as shall,\n   as its imperfect. It also expresses duty or moral obligation; as, he\n   should do it whether he will or not. In the early English, and hence in\n   our English Bible, shall is the auxiliary mainly used, in all the\n   persons, to express simple futurity. (Cf. Will, v. t.) Shall may be\n   used elliptically; thus, with an adverb or other word expressive of\n   motion go may be omitted.",aux. 将,,4,1,zk gk,474,2197,,,
shalt,ʃælt;ʃәlt;ʃilt, 2d per. sing. of Shall.,vbl.shall的第二人称单数现在式,,,,,19967,0,,,
shame,ʃeim,n. a painful emotion resulting from an awareness of inadequacy or guilt\nn. a state of dishonor\nv. compel through a sense of shame\nv. cause to be ashamed,"n. 羞耻, 羞愧, 耻辱\nvt. 使羞愧, 侮辱",,3,1,zk gk cet4 cet6 ky,3668,3767,d:shamed/3:shames/p:shamed/i:shaming/s:shames,,
Shand,,,n. (Shand)人名；(英)尚德,,,,,43800,0,,,
shane,ʃein,,n. 谢恩（女子名）,,,,,17126,0,,,
shank,ʃæŋk,n. a cut of meat (beef or veal or mutton or lamb) from the upper part of the leg\nn. the part of the human leg between the knee and the ankle\nn. cylinder forming a long narrow part of something\nn. cylinder forming the part of a bolt between the thread and the head,"n. 胫, 腿骨, 杆, 柄\nvt. 用铁球棒末端击球\nvi. 花从病梗上枯萎脱落",,1,,,16453,12583,s:shanks/d:shanked/p:shanked/i:shanking/3:shanks,,
shape,ʃeip,"n. any spatial attributes (especially as defined by outline)\nn. the spatial arrangement of something as distinct from its substance\nn. a concrete representation of an otherwise nebulous concept\nv. make something, usually for a specific function","n. 形状, 形态, 外形, 形式, 身材\nvt. 定形, 使成形, 塑造, 计划, 使符合\nvi. 成形, 形成, 成长\n[计] 形状",,4,1,zk gk cet4 cet6 ky,1200,1267,s:shapes/d:shaped/i:shaping/p:shaped/3:shapes,,
shard,ʃɑ:d,n. a broken piece of a brittle artifact,"n. 陶瓷碎片, 鞘翅, 薄硬壳",,,,gre,22511,10720,s:shards,,
share,ʃєә,n. assets belonging to or due to or contributed by an individual person or group\nn. any of the equal portions into which the capital stock of a corporation is divided and ownership of which is evidenced by a stock certificate\nv. have in common\nv. use jointly or in common,"n. 部分, 参与, 一份, 参股, 份额\nvt. 均分, 分担, 分享, 分配, 共有\nvi. 分享\n[计] 共享; DOS外部命令:在网络或多工系统中提供文件共享\n文件锁定及检测磁盘更动和对超过32MB硬盘分区的支持",,5,1,zk gk cet4 cet6 ky,620,711,s:shares/d:shared/i:sharing/p:shared/3:shares,,
shark,ʃɑ:k,n. any of numerous elongate mostly marine carnivorous fishes with heterocercal caudal fins and tough skin covered with small toothlike scales\nn. a person who is ruthless and greedy and dishonest\nn. a person who is unusually skilled in certain ways\nv. play the shark; act with trickery,"n. 鲨鱼, 骗子\nv. 诈骗",,1,,gk cet6 ky,7971,4438,s:sharks/i:sharking/p:sharked/3:sharks/d:sharked,,
sharp,ʃɑ:p,n. a musical notation indicating one half step higher than the note named\nn. a long thin sewing needle with a sharp point\ns. harsh\na. keenly and painfully felt; as if caused by a sharp edge or point,"n. 半升音调, 利刃, 骗子\na. 锋利的, 明显的, 敏锐的, 急剧的, 尖刻的, 严厉的, 刺耳的, 精明的\nadv. 锐利地, 急速地",,4,1,gk cet4 cet6 ky toefl ielts,2035,2049,s:sharps,,
shaun,,,n. 肖恩（男子名）,,,,,10773,0,,,
shave,ʃeiv,n. the act of removing hair with a razor\nv. remove body hair with a razor\nv. cut closely\nv. cut the price of,"n. 修面, 刮胡子, 幸免, 剃刀\nvt. 修面, 剃, 修剪, 掠过\nvi. 刮脸, 勉强通过",,2,1,gk cet4 cet6 ky ielts,7191,5779,d:shaved/i:shaving/p:shaved/3:shaves/s:shaves,,
shawl,ʃɒ:l,n. cloak consisting of an oblong piece of cloth used to cover the head and shoulders,"n. 披肩, 围巾\nvt. 用披肩裹",,1,,gre,12685,11627,s:shawls/p:shawled,,
shawn,ʃɔ:n,n. United States dancer and choreographer who collaborated with Ruth Saint Denis (1891-1972),n. 肖恩（男子、女子名）,,,,,46940,0,,,
sheaf,ʃi:f,n a package of several things tied together for carrying or storing,"n. 束, 捆, 扎\nvt. 捆, 束",,,,gre,16348,16707,s:sheaves,,
shear,ʃiә,n. (physics) a deformation of an object in which parallel planes remain parallel but are shifted in a direction parallel to themselves\nn. a large edge tool that cuts sheet metal by passing a blade through it\nv. cut with shears\nv. cut or cut through with shears,"n. 修剪, 剪下的东西, 大剪刀, 切变, 剪切机, 切\nvt. 修剪, 割, 剥夺, 横越, 削剪\nvi. 剪, 修剪, 剪羊毛, 切断",,1,,cet4 cet6 ky toefl ielts gre,10041,9594,s:shears/d:shorn/i:shearing/p:sheared/3:shears,,
Sheba,'ʃi:bә,,Queen of ~ (基督教《圣经》中朝觐所罗门王以测其智慧的) 示巴女王,,,,,33768,0,,,
sheen,ʃi:n,n the visual property of something that shines with reflected light,"n. 光辉, 光彩, 光泽\na. 光辉的, 发光的, 有光泽的\nvi. 发出光泽",,1,,gre,15025,12743,p:sheened/d:sheened/s:sheens/i:sheening,,
sheep,ʃi:p,n. woolly usually horned ruminant mammal related to the goat\nn. a timid defenseless simpleton who is readily preyed upon\nn. a docile and vulnerable person who would rather follow than make an independent decision,"n. 羊, 胆小者",,2,1,zk gk ielts,2697,4210,s:sheeps,,
sheer,ʃiә,v. cause to sheer\nr. straight up or down without a break\nr. directly,"a. 绝对的, 全然的, 纯粹的, 透明的, 峻峭的\nvi. 偏转, 偏航\nvt. 使急转向, 使偏航\nadv. 完全, 全然, 峻峭\nn. 偏航",,2,,cet6 ky toefl ielts gre,3368,4198,s:sheers/p:sheered/i:sheering/3:sheers/d:sheered,,
sheet,ʃi:t,n. any broad thin expanse or surface\nn. paper used for writing or printing\nn. bed linen consisting of a large rectangular piece of cotton or linen cloth; used in pairs\nn. a flat artifact that is thin relative to its length and width,"n. 床单, 张, 纸张, 印刷品, 裹尸布, 薄片\nvt. 盖上被单, 遍布\nvi. 大片落下\na. 片状的, 成薄片的\n[计] 工作表",,3,1,gk cet4 cet6 ky toefl ielts,1430,1753,s:sheets/d:sheeted/p:sheeted/i:sheeting/3:sheets,,
SHEFF,,,设菲尔德（Sheffield的缩写）,,,,,18085,0,,,
sheik,,n. the leader of an Arab village or family,"n. 酋长, 王子, 村长, 族长, 教长, 导师, 有威信的丈夫",,,,,34517,17194,s:sheiks,,
shelf,ʃelf,n. a support that consists of a horizontal surface for holding objects,"n. 架子, 搁板\n[化] 架子",,2,1,zk gk cet4 cet6 ky toefl ielts,2930,2947,s:shelves,,
shell,ʃel,n. ammunition consisting of a cylindrical metal casing containing an explosive charge and a projectile; fired from a large gun\nn. the material that forms the hard outer covering of many animals\nn. the hard usually fibrous outer layer of some fruits especially nuts\nn. the exterior covering of a bird's egg,"n. 贝壳, 壳, 外形, 炮弹\nvt. 去壳, 脱落, 炮轰\nvi. 剥落, 脱壳\n[计] 外壳; DOS内部命令:指定命令行处理程序",,3,1,cet4 cet6 ky toefl ielts gre,2687,2560,s:shells/i:shelling/d:shelled/p:shelled/3:shells,,
sheng,ʃeŋ,,n. 笙（中国的一种民族乐器）,,,,,0,37415,,,
sherd,ʃәd,n a broken piece of a brittle artifact,"n. (瓷)碎片, 破片",,,,,30149,31577,s:sherds,,
Shiel,ʃiːl,n. A sheeling.,n. (Shiel)人名；(英)希尔\n希尔（人名）,,,,,29433,0,s:shiels,,
shift,ʃift,n. an event in which something is displaced without rotation\nn. the time period during which you are at work\nn. the act of moving from one place to another\nn. a crew of workers who work for a specific period of time,"n. 变化, 移动, 轮班, 手段, 应急办法, 移位\nvt. 替换, 转移, 改变, 推卸, 变速\nvi. 转换, 移动, 转变, 推托, 变速\n[计] DOS内部命令:该命令可将批处理参数向左移动一个位置",,3,1,cet4 cet6 ky toefl ielts,2322,1680,s:shifts/d:shifted/p:shifted/i:shifting/3:shifts,,
shill,ʃil,n. a decoy who acts as an enthusiastic customer in order to stimulate the participation of others\nv. act as a shill,"n. 小贩的同伙, 赌棍的党羽",,,,,0,28027,,,
shine,ʃain,"v. emit light; be bright, as of the sun or a light\nv. be distinguished or eminent\nv. be clear and obvious\nv. throw or flash the light of (a lamp)","n. 光泽, 阳光\nvt. 使发光\nvi. 照耀, 发光, 发亮",,2,1,zk gk toefl,3329,3385,p:shone/i:shining/3:shines/d:shone,,
shiny,'ʃaini,s reflecting light\na having a shiny surface or coating\ns made smooth and bright by or as if by rubbing; reflecting a sheen or glow,"a. 有光泽的, 发光的, 辉煌的, 磨光的, 磨损的",,2,1,toefl,6457,5128,r:shinier/t:shiniest,,
